"May 22, 2022",95749937,https://all.worldfront.co/axis/orders.php?action=edit&oID=95749937,Lamisil AT Athletes Foot Spray 15ml,Health,Amazon US1,World,*
"May 22, 2022",95862833,https://all.worldfront.co/axis/orders.php?action=edit&oID=95862833,Lamisil AT Athletes Foot Spray 15ml,Health,Amazon US1,World,*
"May 22, 2022",96144741,https://all.worldfront.co/axis/orders.php?action=edit&oID=96144741,Lamisil AT Athletes Foot Spray 15ml,Health,Amazon US1,World,*
"May 22, 2022",96340647,https://all.worldfront.co/axis/orders.php?action=edit&oID=96340647,"BEAUTURAL Fabric Shaver and Lint Remover, Sweater Defuzzer with 2-Speeds, 2 Replaceable Stainless Steel Blades, Battery Operated, Remove Clothes Fuzz, Lint Balls, Pills, Bobbles",Homeware,Amazon AU2,World,*
"May 22, 2022",97075046,https://all.worldfront.co/axis/orders.php?action=edit&oID=97075046,Zig Zag TIN Automatic Cigarette Tobacco Rolling Machine Box ZigZag Roller Roll,Kitchen,Kogan,World,*
"May 22, 2022",97493479,https://all.worldfront.co/axis/orders.php?action=edit&oID=97493479,"Passion Lubes Maximum Strength Anal Desensitizing Lube, 8.25 fl oz",Health,Amazon AU2,World,*
"May 22, 2022",97921207,https://all.worldfront.co/axis/orders.php?action=edit&oID=97921207,"(Multicolor) - RAYCOP LITE UV Sanitising HEPA Allergen Vacuum Effectively Removes Dust Mite Matters, Bacteria, Viruses and Pollen",Homeware,Amazon AU2,World,*
"May 22, 2022",98075118,https://all.worldfront.co/axis/orders.php?action=edit&oID=98075118,Lamisil AT Athletes Foot Spray 15ml,Health,Amazon US1,World,*
"May 22, 2022",98915302,https://all.worldfront.co/axis/orders.php?action=edit&oID=98915302,Lamisil AT Athletes Foot Spray 15ml,Health,Amazon US1,World,*
"May 22, 2022",98920234,https://all.worldfront.co/axis/orders.php?action=edit&oID=98920234,"Simplux Dripping Free-Flowing 3D Flameless LED Pillar Candle with Remote Control,Battery Operate for Valentine's Day, 8.9cm x 13cm , Red",Homeware,Kogan,World,*
"May 22, 2022",99601276,https://all.worldfront.co/axis/orders.php?action=edit&oID=99601276,Lamisil AT Athletes Foot Spray 15ml,Health,Amazon US1,World,*
"May 22, 2022",704191071,https://all.worldfront.co/axis/orders.php?action=edit&oID=704191071,"Tefal GV9611G0 Pro Express Ultimate +, 2600 W, 1.9 litres, Black",Homeware,Fishpond AU,AU,*
"May 22, 2022",711991807,https://all.worldfront.co/axis/orders.php?action=edit&oID=711991807,"LONDONTOWN Illuminating Nail Concealer, Vegan, Cruelty Free, Gluten Free, Paraben Free",Beauty,Fishpond AU,AU,*
"May 22, 2022",744600537,https://all.worldfront.co/axis/orders.php?action=edit&oID=744600537,"Krink K-60 Paint Marker, Light Blue",Arts & Crafts,Fishpond AU,AU,*
"May 22, 2022",771535130,https://all.worldfront.co/axis/orders.php?action=edit&oID=771535130,Maximum Living MineralRich with Aloe Vera 950ml (32 Fl Oz),Health,Fishpond AU,AU,*
"May 22, 2022",791781581,https://all.worldfront.co/axis/orders.php?action=edit&oID=791781581,"TheraBreath 24 Hour Healthy Gums Periodontist Formulated Oral Rinse, 470ml (Pack of 2)",Health,Fishpond AU,AU,*
"May 21, 2022",51464072,https://all.worldfront.co/axis/orders.php?action=edit&oID=51464072,Concession Express Cotton Candy Floss Sugar (10 Pack),Kitchen,Fishpond NZ,NZ,*
"May 21, 2022",57466096,https://all.worldfront.co/axis/orders.php?action=edit&oID=57466096,24 The Wiggles (#2) Cupcake Cake Toppers,Kitchen,Fishpond NZ,NZ,*
"May 21, 2022",57466096,https://all.worldfront.co/axis/orders.php?action=edit&oID=57466096,24 x Cars (#2) Cupcake Cake Toppers,Kitchen,Fishpond NZ,NZ,*
"May 21, 2022",90254322,https://all.worldfront.co/axis/orders.php?action=edit&oID=90254322,"Baby Lounger, Baby Nest Stars Portable Super Soft Organic Cotton and Breathable Newborn Lounger - Perfect for Co-Sleeping",Baby,Amazon AU2,World,*
"May 21, 2022",91158356,https://all.worldfront.co/axis/orders.php?action=edit&oID=91158356,Candy Cane Spoons 1doz,Kitchen,Fishpond World,World,*
"May 21, 2022",91158356,https://all.worldfront.co/axis/orders.php?action=edit&oID=91158356,Christmas Slap Bracelet with Jingle Bells - Jewellery - 12 Pieces,Toys,Fishpond World,World,*
"May 21, 2022",752651740,https://all.worldfront.co/axis/orders.php?action=edit&oID=752651740,"THE PROTEIN WORKS | Vegan Wondershake | Vegan Protein Shake | Super Smooth, Amazing Taste | 30 Servings | Vanilla Crème, 750 g",Health,Fishpond AU,AU,*
"May 21, 2022",793926231,https://all.worldfront.co/axis/orders.php?action=edit&oID=793926231,"NeoCell Collagen +C Pomegranate Liquid, 4g Collagen Types 1 & 3 Plus Vitamin C, Healthy Skin, Hair, Nails and Joint Support 470mls (Package May Vary)",Health,Fishpond AU,AU,*
"May 20, 2022",59906314,https://all.worldfront.co/axis/orders.php?action=edit&oID=59906314,"Flexible Corner Connector for Philips Hue Lightstrip (0.06m/ 6cm, 5 Pack, White)",Lifestyle,Fishpond NZ,NZ,*
"May 20, 2022",90240942,https://all.worldfront.co/axis/orders.php?action=edit&oID=90240942,AquaSonic Black Series Ultra Whitening Toothbrush – ADA Accepted Electric Toothbrush - 8 Brush Heads & Travel Case - Ultra Sonic Motor & Wireless Charging - 4 Modes w Smart Timer - Sonic Electric,Health,Amazon AU2,World,*
"May 20, 2022",90286092,https://all.worldfront.co/axis/orders.php?action=edit&oID=90286092,"OCOOPA Hand Warmers, Rechargeable Hand Warmer 5200mAh Power Bank, Electric Portable Pocket USB Warmer, Heat Therapy Great for Outdoor Sports, Winter Gifts for Women, Men",Sports & Outdoors,Kogan,World,*
"May 20, 2022",91676841,https://all.worldfront.co/axis/orders.php?action=edit&oID=91676841,Edison Screw Bulb Holder in White for Lamp or Pendant Use supplied with Shade Ring and Flex Grip,Homeware,Trade Me,World,*
"May 20, 2022",92418115,https://all.worldfront.co/axis/orders.php?action=edit&oID=92418115,"Nature's Answer Natures' Answer Alcohol-Free Mullein Leaf, 1-Fluid Ounce",Health,Amazon AU2,World,*
"May 20, 2022",94501823,https://all.worldfront.co/axis/orders.php?action=edit&oID=94501823,"The Foster Bifocal Sun Reader Sport and Wrap Around Reading Sunglasses, Unisex Half Frame Readers for Men and Women in Black +1.50 (Microfiber Pouch Included)",Health,Amazon AU2,World,*
"May 20, 2022",95855597,https://all.worldfront.co/axis/orders.php?action=edit&oID=95855597,"Anti Alcohol Drink Support Supplement - Craving Support,Liver Health,Reduce Alcohol Intake Formula - Kudzu,Milk Thistle Holy Basil,DHM Natural Detoxify,Gradual Reduction,Nutrient Replenisher - 15 Days",Health,Amazon AU2,World,*
"May 20, 2022",96818047,https://all.worldfront.co/axis/orders.php?action=edit&oID=96818047,"Ekena Millwork CM12TRACS Traditional Ceiling Medallion, 30cm OD x 2.5cm P (Fits Canopies up to 7cm ), Hand-Painted Antique Copper",Homeware,Kogan,World,*
"May 20, 2022",97221492,https://all.worldfront.co/axis/orders.php?action=edit&oID=97221492,RMR-86 Instant Mold Stain & Mildew Stain Remover - 32 oz w/Sprayer,Homeware,Amazon AU2,World,*
"May 20, 2022",98065047,https://all.worldfront.co/axis/orders.php?action=edit&oID=98065047,Lowenergie 12w LED Driver Transformer 240V AC to 12V DC for LED Lighting,Homeware,Trade Me,World,*
"May 20, 2022",705529242,https://all.worldfront.co/axis/orders.php?action=edit&oID=705529242,"OmegaVia EPA 500. Pharmaceutical Grade EPA Omega-3. Triglyceride-form EPA-only formula, 120 Capsules. 500 mg EPA per pill.",Health,Fishpond AU,AU,*
"May 20, 2022",717929037,https://all.worldfront.co/axis/orders.php?action=edit&oID=717929037,Boxine 111101 1033 – Tonie Die Olchis on Birthday Road – Educational Toy,Toys,Fishpond AU,AU,*
"May 20, 2022",729170226,https://all.worldfront.co/axis/orders.php?action=edit&oID=729170226,Riemann P20 Once a Day 10 Hours Sun Protection - SPF20 Medium (100ml),Beauty,Fishpond AU,AU,*
"May 20, 2022",781688310,https://all.worldfront.co/axis/orders.php?action=edit&oID=781688310,AWOTAC Tactical Fibre Optics Low Profile Flip up Iron Sight with Visible Front Red Dot Sight and Rear Green Dot Sight Fit Picatinny Weaver Rails,Sports & Outdoors,Fishpond AU,AU,*
"May 19, 2022",51294356,https://all.worldfront.co/axis/orders.php?action=edit&oID=51294356,9 Meals 3 Day 3600 Calorie Emergency Survival Food Bar Ration Car Kit Bug Out,Lifestyle,Fishpond NZ,NZ,*
"May 19, 2022",52686675,https://all.worldfront.co/axis/orders.php?action=edit&oID=52686675,Ohuhu 60 Colours Dual Tips Permanent Marker Pens Art Markers Highlighters with Carrying Case for Drawing Sketching Adult Colouring Highlighting and Underlining,Arts & Crafts,Fishpond NZ,NZ,*
"May 19, 2022",57164421,https://all.worldfront.co/axis/orders.php?action=edit&oID=57164421,OEM Mercury 100 Hr Maintenance Kit - 75-115HP FourStroke 2.1L Outboard 8M0097854,Sports & Outdoors,Fishpond NZ,NZ,*
"May 19, 2022",57312685,https://all.worldfront.co/axis/orders.php?action=edit&oID=57312685,"Terro PreFilled Liquid Ant Killer II Baits, 3-Packs of 6 Baits Each",Sports & Outdoors,Fishpond NZ,NZ,*
"May 19, 2022",90012734,https://all.worldfront.co/axis/orders.php?action=edit&oID=90012734,"Kerastase Densifique Densimorphose Thickening Treatment Mousse, 5 Ounce",Beauty,Amazon US1,World,*
"May 19, 2022",92230161,https://all.worldfront.co/axis/orders.php?action=edit&oID=92230161,"Kerastase Densifique Densimorphose Thickening Treatment Mousse, 5 Ounce",Beauty,Amazon US1,World,*
"May 19, 2022",96654378,https://all.worldfront.co/axis/orders.php?action=edit&oID=96654378,biOrb 46143.0 Starfish Set 3 Blue Aquariums,Pets,Kogan,World,*
"May 19, 2022",98570952,https://all.worldfront.co/axis/orders.php?action=edit&oID=98570952,Revell 63959 Spitfire Mk.II Model Set,Toys,Kogan,World,*
"May 19, 2022",98893069,https://all.worldfront.co/axis/orders.php?action=edit&oID=98893069,Mermaid Love Wish Pearl Kit Cultured Pearl Necklace Set with Stainless Steel Chain 41cm,Arts & Crafts,Trade Me,World,*
"May 19, 2022",745770719,https://all.worldfront.co/axis/orders.php?action=edit&oID=745770719,"Bruno Banani Woman Eau de Toilette Natural Spray, 20 ml",Beauty,Fishpond AU,AU,*
"May 19, 2022",769017104,https://all.worldfront.co/axis/orders.php?action=edit&oID=769017104,"USDA Certified Organic Turmeric Curcumin Supplement 1500mg with BioPerine | 95% Standardised Curcuminoid Extract & Organic Root Powder with Piperine Black Pepper Fruit (10mg), 120 Veggie Capsules",Health,Fishpond AU,AU,*
"May 19, 2022",769641385,https://all.worldfront.co/axis/orders.php?action=edit&oID=769641385,Swivel Faucet Sprayer Aramox 304 Stainless Steel Kitchen Sink Faucet Pull Out 360-Degree Swivel Spout Kitchen Hot Cold Mixer Tap,Kitchen,Fishpond AU,AU,*
"May 19, 2022",785300252,https://all.worldfront.co/axis/orders.php?action=edit&oID=785300252,Panasonic EW1211W Dental Care Cordless Rechargeable Oral Irrigator,Health,Fishpond AU,AU,*
"May 18, 2022",58984909,https://all.worldfront.co/axis/orders.php?action=edit&oID=58984909,Sanamed Micro-Silver Foot Cream Foam Foot Foam Foam Foot Cream for Very Dry Skin,Beauty,Fishpond NZ,NZ,*
"May 18, 2022",91615935,https://all.worldfront.co/axis/orders.php?action=edit&oID=91615935,Handmade wooden smoking pipe metal bowl cover tobacco,Homeware,Kogan,World,*
"May 18, 2022",91657685,https://all.worldfront.co/axis/orders.php?action=edit&oID=91657685,"Toncoo 10Pcs Premium Wood Place Card Holders with Swirl Wire and 20 Pcs Kraft Place Cards, Rustic Wood Table Number Holders Stands, Name Cards Photo Holders for Wedding Party Sign Food Cards Label",Kitchen,Kogan,World,*
"May 18, 2022",95081577,https://all.worldfront.co/axis/orders.php?action=edit&oID=95081577,Phoenix Square Full Reader Sunglasses,Bags,Kogan,World,*
"May 18, 2022",95855542,https://all.worldfront.co/axis/orders.php?action=edit&oID=95855542,Zoostliss 150mm LCD Digital Electronic Carbon Fiber Vernier Calipers Gauge Micrometer with Large LCD Screen Display Inch/Metric,Lifestyle,Amazon AU2,World,*
"May 18, 2022",96099798,https://all.worldfront.co/axis/orders.php?action=edit&oID=96099798,"DASH DMW001WH Mini Maker for Individual Waffles, Hash Browns, Keto Chaffles with Easy to Clean, Non-Stick Surfaces, 4 Inch, White",Kitchen,Amazon SG2,World,*
"May 18, 2022",99711924,https://all.worldfront.co/axis/orders.php?action=edit&oID=99711924,"Heart Calm- Support and Maintain a Healthy Heart Rhythm- A Natural, Fast-Acting Formula with Magnesium Taurate, Glycinate, Malate and more. 90 Capsules.",Health,Fishpond World,World,*
"May 18, 2022",705028507,https://all.worldfront.co/axis/orders.php?action=edit&oID=705028507,"Dyson Airwrap Complete Fuchsia Pink Set Hair Styler, 600 g",Beauty,Fishpond AU,AU,*
"May 18, 2022",734917498,https://all.worldfront.co/axis/orders.php?action=edit&oID=734917498,"Aspercreme Pain Relieving Creme - 35ml, Pack of 5",Health,Fishpond AU,AU,*
"May 18, 2022",783973976,https://all.worldfront.co/axis/orders.php?action=edit&oID=783973976,Organic Ashwagandha Veggie Capsules | Certified Organic by Soil Association | 100% Natural Herbal Supplement | Ayurveda Formula known as Withania Somnifera | KSM-66 | KSM66 | 60 Easy Swallow Pills,Health,Fishpond AU,AU,*
"May 18, 2022",797982084,https://all.worldfront.co/axis/orders.php?action=edit&oID=797982084,Obagi Nu-Derm Fx System Normal to Dry Pack of 1,Beauty,Fishpond AU,AU,*
"May 17, 2022",57922366,https://all.worldfront.co/axis/orders.php?action=edit&oID=57922366,"Pro-Cure Anchovy Oil, 60ml",Sports & Outdoors,Fishpond NZ,NZ,*
"May 17, 2022",59093059,https://all.worldfront.co/axis/orders.php?action=edit&oID=59093059,DEWALT DCN681D1 Cordless Narrow Crown Stapler Kit,Lifestyle,Fishpond NZ,NZ,*
"May 17, 2022",91202231,https://all.worldfront.co/axis/orders.php?action=edit&oID=91202231,"Andux Zone Metal Folding Practise Trainer Tool, Training Tool wooden handle No Offensive Blade Silver CS/HDD10",Sports & Outdoors,Kogan,World,*
"May 17, 2022",91767947,https://all.worldfront.co/axis/orders.php?action=edit&oID=91767947,"Glitter Paw Print Bling Pet ID Tag, Custom Engraved",Pets,Trade Me,World,*
"May 17, 2022",94000797,https://all.worldfront.co/axis/orders.php?action=edit&oID=94000797,Outus 60 Pieces Fridge Magnets Round Ferrite Magnets Craft Magnets and 25 mm Glass Cabochons for Fridge Magnet Making DIY Craft,Kitchen,Kogan,World,*
"May 17, 2022",94581865,https://all.worldfront.co/axis/orders.php?action=edit&oID=94581865,"Aleko Electronic Pet Fencing System, 1 Dog",Lifestyle,Kogan,World,*
"May 17, 2022",95501547,https://all.worldfront.co/axis/orders.php?action=edit&oID=95501547,"BaBylissPRO Nano Titanium Travel Dryer, Blue",Beauty,Amazon AU2,World,*
"May 17, 2022",95775512,https://all.worldfront.co/axis/orders.php?action=edit&oID=95775512,Energizer CR2430 3V Lithium,Homeware,Trade Me,World,*
"May 17, 2022",95916207,https://all.worldfront.co/axis/orders.php?action=edit&oID=95916207,(Chisel Tip Silver) - DecoColor Premium Oil Based Paint Marker Carded-Chisel Tip Silver,Homeware,Amazon AU2,World,*
"May 17, 2022",95916207,https://all.worldfront.co/axis/orders.php?action=edit&oID=95916207,Uchida DCR-300-C Marvy Deco Colour Paint Chisel Tip Marker Remover,Toys,Amazon AU2,World,*
"May 17, 2022",97902231,https://all.worldfront.co/axis/orders.php?action=edit&oID=97902231,Kenra Volume Spray 80% VOC 16-Ounce,Beauty,Amazon AU2,World,*
"May 17, 2022",98255080,https://all.worldfront.co/axis/orders.php?action=edit&oID=98255080,Quietest Aquarium Air Pump Ultra Silent High Energy Saving Oxygen Air Pump Aquarium for Fish Tank with Air Stone and Silicone Tube Black,Pets,Amazon AU2,World,*
"May 17, 2022",742483818,https://all.worldfront.co/axis/orders.php?action=edit&oID=742483818,Taiwan High Mountain Alishan Oolong Tea Taiwan Tea 200g,Kitchen,Fishpond AU,AU,*
"May 17, 2022",746231749,https://all.worldfront.co/axis/orders.php?action=edit&oID=746231749,2 x Blephasol 100ml Sensitive Eyelids Eye Lotion,Health,Fishpond AU,AU,*
"May 17, 2022",746962140,https://all.worldfront.co/axis/orders.php?action=edit&oID=746962140,Potters Chesty Cough Pastilles (2 Packs of 20),Health,Fishpond AU,AU,*
"May 17, 2022",753539253,https://all.worldfront.co/axis/orders.php?action=edit&oID=753539253,"Genius Drops Focus Supplement for Kids, Supports Healthy Brain Function to Improve Concentration & Attention for School, Natural Calming Supplement, 60ml",Baby,Fishpond AU,AU,*
"May 17, 2022",795505436,https://all.worldfront.co/axis/orders.php?action=edit&oID=795505436,"Organic Irish Sea Moss Gummies with Apple Cider Vinegar, Black Seed Oil, Chlorophyll - Thyroid, Digestion, Mood, Energy & Immune Support - Adults & Kids, Women & Men - 60 Vegan Gummies",Health,Fishpond AU,AU,*
"May 16, 2022",57614764,https://all.worldfront.co/axis/orders.php?action=edit&oID=57614764,Wirewound Resistor for Ring Video Doorbell (1st Gen) and Ring Video Doorbell 2,Lifestyle,Fishpond NZ,NZ,*
"May 16, 2022",90365816,https://all.worldfront.co/axis/orders.php?action=edit&oID=90365816,Mediker 2 X Anti Lice Remover Treatment Head Shampoo 100% Lice Remove 50Ml X 2 = 100Ml,Beauty,Fishpond World,World,*
"May 16, 2022",90408651,https://all.worldfront.co/axis/orders.php?action=edit&oID=90408651,Powerhouse Golf 12V 18-27 Hole Golf Trolley LiFePO4 Lithium Battery,Sports & Outdoors,Fishpond World,World,*
"May 16, 2022",95640625,https://all.worldfront.co/axis/orders.php?action=edit&oID=95640625,hiccapop Wipe Warmer and Baby Wet Wipes Dispenser Holder Case with Changing Light,Baby,Amazon AU2,World,*
"May 16, 2022",95672440,https://all.worldfront.co/axis/orders.php?action=edit&oID=95672440,"BaBylissPRO Nano Titanium Travel Dryer, Blue",Beauty,Amazon AU2,World,*
"May 16, 2022",705529242,https://all.worldfront.co/axis/orders.php?action=edit&oID=705529242,"OmegaVia Pharma-Grade Fish Oil, Enteric Odourless/Burp-Free, 60 Capsules. 1105 mg Omega-3 - Highest Omega-3 per pill on Amazon.",Health,Fishpond AU,AU,*
"May 16, 2022",705733529,https://all.worldfront.co/axis/orders.php?action=edit&oID=705733529,"hansgrohe Croma 100 Vario hand shower, 4 spray modes, chrome",Homeware,Fishpond AU,AU,*
"May 16, 2022",730865677,https://all.worldfront.co/axis/orders.php?action=edit&oID=730865677,Raw Classic Tobacco Tin | 4 Raw Classic King Size Rolling Papers | 2 Books of Raw Rolling Tips | 55 mm Wooden Herb Grinder with Zinc Alloy Teeth,Kitchen,Fishpond AU,AU,*
"May 16, 2022",772520557,https://all.worldfront.co/axis/orders.php?action=edit&oID=772520557,Trehalose - 450g,Health,Fishpond AU,AU,*
"May 16, 2022",781701894,https://all.worldfront.co/axis/orders.php?action=edit&oID=781701894,Karndean Flooring Clean Start Kit Floor Sealing Floor Care Kit Dim Glow Refresh Routine Cleaner Basic Stripper,Homeware,Fishpond AU,AU,*
"May 16, 2022",791663890,https://all.worldfront.co/axis/orders.php?action=edit&oID=791663890,LiveMoor Pure Fragrance Oil - Hyacinth - 25ml - Paraben Free,Arts & Crafts,Fishpond AU,AU,*
"May 15, 2022",55033411,https://all.worldfront.co/axis/orders.php?action=edit&oID=55033411,Fenjal Luxury Shower Mousse 200ml **2 PACK DEAL**,Beauty,Fishpond NZ,NZ,*
"May 15, 2022",94528259,https://all.worldfront.co/axis/orders.php?action=edit&oID=94528259,"Replogle Globe Pioneer Globe, 12""(dia)",Toys,Amazon CA2,World,*
"May 15, 2022",95411108,https://all.worldfront.co/axis/orders.php?action=edit&oID=95411108,Marmitek PowerMid XL infrared extender set,Electronics,Kogan,World,*
"May 15, 2022",721952568,https://all.worldfront.co/axis/orders.php?action=edit&oID=721952568,Ghost Sweetheart 30 Gift Set Peach,Beauty,Fishpond AU,AU,*
"May 15, 2022",749731683,https://all.worldfront.co/axis/orders.php?action=edit&oID=749731683,Really Tiny Book Light - Mint Green,Toys,Fishpond AU,AU,*
"May 14, 2022",53755879,https://all.worldfront.co/axis/orders.php?action=edit&oID=53755879,"DONA Pheromone Infused Perfume Roll-On, 0.34 Oz (10 mL), Too Fabulous",Beauty,Fishpond NZ,NZ,*
"May 14, 2022",93227803,https://all.worldfront.co/axis/orders.php?action=edit&oID=93227803,"De'Longhi Bend Line, Ceramic Fan Heater 2kw, Room Thermastat, 24hr Timer, Digital Control Panel, Anti Frost Frunction, Oscillating base, Auto-Off, For Rooms up to 60m3, HFX60V20, Black and White",Homeware,Kogan,World,*
"May 14, 2022",708076723,https://all.worldfront.co/axis/orders.php?action=edit&oID=708076723,Pipedream BJ Blast Oral Sex Candy Strawberry,Health,Fishpond AU,AU,*
"May 14, 2022",729023570,https://all.worldfront.co/axis/orders.php?action=edit&oID=729023570,Carbomer Eye Gel 10g x10 tubes (Medicom Healthcare),Health,Fishpond AU,AU,*
"May 14, 2022",769992028,https://all.worldfront.co/axis/orders.php?action=edit&oID=769992028,Oregano Oil - Louianna Certified Pure Organic Oil of Wild Oregano Liquid Drops Extra Strength 30ml / 1 Fluid Ounce 80% Carvacol North America's Best Selling Brand!,Health,Fishpond AU,AU,*
"May 14, 2022",774771692,https://all.worldfront.co/axis/orders.php?action=edit&oID=774771692,"Magnesium TAURATE 500mg 60 Tablets Cardiovascular protectant, Blood Flow. 2 Months Supply. by Vytox",Health,Fishpond AU,AU,*
"May 14, 2022",774771692,https://all.worldfront.co/axis/orders.php?action=edit&oID=774771692,"Nature's Bounty Cinnamon Pills and Chromium Herbal Health Supplement, Promotes Sugar Metabolism and Heart Health, 2000g, 60 Capsules",Health,Fishpond AU,AU,*
"May 13, 2022",786585387,https://all.worldfront.co/axis/orders.php?action=edit&oID=786585387,Airgoesin LED Tonsil Stone Remover Bad breath cure Easily navigate tonsil crypts with 3 interchangeable tips nozzles+1 Irrigator Clean Curved Tip Syringe+Curettage pick Oral hygiene Care,Health,Fishpond AU,AU,*
"May 13, 2022",789355764,https://all.worldfront.co/axis/orders.php?action=edit&oID=789355764,"Model 1800 Series Desktop Electric Pencil Sharpener, Charcoal, Black",Stationery,Fishpond AU,AU,*
"May 13, 2022",799700699,https://all.worldfront.co/axis/orders.php?action=edit&oID=799700699,"Thick Hair Growth Vitamins – Anti Hair Loss DHT Blocker Stimulates Fast Hair Growth for Weak, Thinning Hair – Biotin Hair Supplement with Keratin Helps Men & Women Grow Perfect Hair, Made in the U.S.",Beauty,Fishpond AU,AU,*
"May 12, 2022",90997831,https://all.worldfront.co/axis/orders.php?action=edit&oID=90997831,DYMO LabelWriter 450,Electronics,Amazon US3,World,*
"May 12, 2022",91786223,https://all.worldfront.co/axis/orders.php?action=edit&oID=91786223,DYMO LabelWriter 450,Electronics,Amazon US3,World,*
"May 12, 2022",92157474,https://all.worldfront.co/axis/orders.php?action=edit&oID=92157474,Bilu-hose Brass Single Hole Two Handle Pot Filler Folding Faucet (Black),Lifestyle,Kogan,World,*
"May 12, 2022",92618518,https://all.worldfront.co/axis/orders.php?action=edit&oID=92618518,DYMO LabelWriter 450,Electronics,Amazon US3,World,*
"May 12, 2022",92998619,https://all.worldfront.co/axis/orders.php?action=edit&oID=92998619,DYMO LabelWriter 450,Electronics,Amazon US3,World,*
"May 12, 2022",93072814,https://all.worldfront.co/axis/orders.php?action=edit&oID=93072814,DYMO LabelWriter 450,Electronics,Amazon US3,World,*
"May 12, 2022",93696327,https://all.worldfront.co/axis/orders.php?action=edit&oID=93696327,DYMO LabelWriter 450,Electronics,Amazon US3,World,*
"May 12, 2022",93726166,https://all.worldfront.co/axis/orders.php?action=edit&oID=93726166,Metal Switchblade Comb - Black by On The Go,Toys,Trade Me,World,*
"May 12, 2022",93924967,https://all.worldfront.co/axis/orders.php?action=edit&oID=93924967,T-Rex Crab Island Jungle Bed,Pets,Kogan,World,*
"May 12, 2022",94263102,https://all.worldfront.co/axis/orders.php?action=edit&oID=94263102,DYMO LabelWriter 450,Electronics,Amazon US3,World,*
"May 12, 2022",94978340,https://all.worldfront.co/axis/orders.php?action=edit&oID=94978340,DYMO LabelWriter 450,Electronics,Amazon US3,World,*
"May 12, 2022",95212857,https://all.worldfront.co/axis/orders.php?action=edit&oID=95212857,DYMO LabelWriter 450,Electronics,Amazon US3,World,*
"May 12, 2022",95521320,https://all.worldfront.co/axis/orders.php?action=edit&oID=95521320,DYMO LabelWriter 450,Electronics,Amazon US3,World,*
"May 12, 2022",96890553,https://all.worldfront.co/axis/orders.php?action=edit&oID=96890553,DYMO LabelWriter 450,Electronics,Amazon US3,World,*
"May 12, 2022",98123492,https://all.worldfront.co/axis/orders.php?action=edit&oID=98123492,DYMO LabelWriter 450,Electronics,Amazon US3,World,*
"May 12, 2022",727119315,https://all.worldfront.co/axis/orders.php?action=edit&oID=727119315,Hair Gain Hair Gummies 1 month supply 60 Gummies Fuller Thicker Hair in one month,Beauty,Fishpond AU,AU,*
"May 11, 2022",90225045,https://all.worldfront.co/axis/orders.php?action=edit&oID=90225045,DYMO LabelWriter 450,Electronics,Amazon US3,World,*
"May 11, 2022",90658134,https://all.worldfront.co/axis/orders.php?action=edit&oID=90658134,DYMO LabelWriter 450,Electronics,Amazon US3,World,*
"May 11, 2022",91065040,https://all.worldfront.co/axis/orders.php?action=edit&oID=91065040,DYMO LabelWriter 450,Electronics,Amazon US3,World,*
"May 11, 2022",91083568,https://all.worldfront.co/axis/orders.php?action=edit&oID=91083568,DYMO LabelWriter 450,Electronics,Amazon US3,World,*
"May 11, 2022",91089072,https://all.worldfront.co/axis/orders.php?action=edit&oID=91089072,DYMO LabelWriter 450,Electronics,Amazon US3,World,*
"May 11, 2022",91256717,https://all.worldfront.co/axis/orders.php?action=edit&oID=91256717,"Exquisite Buggy My Sweet Baby - Botellas mágicas desaparecidas - Incluye 1 leche, 1 botella de jugo con chupete para muñeca bebé (colorido)",Toys,Amazon MX2,World,*
"May 11, 2022",91695483,https://all.worldfront.co/axis/orders.php?action=edit&oID=91695483,DYMO LabelWriter 450,Electronics,Amazon US3,World,*
"May 11, 2022",92914281,https://all.worldfront.co/axis/orders.php?action=edit&oID=92914281,DYMO LabelWriter 450,Electronics,Amazon US3,World,*
"May 11, 2022",93106154,https://all.worldfront.co/axis/orders.php?action=edit&oID=93106154,Himalaya Organic Gymnema 60 Caplets for Sugar Destroyer & Healthy Glucose Metabolism 700mg (Pack of 2),Beauty,Amazon AU2,World,*
"May 11, 2022",93150126,https://all.worldfront.co/axis/orders.php?action=edit&oID=93150126,"Wireless Door Bell, AVANTEK Mini Waterpoof Doorbell Chime Operating at 1000 Feet with 52 Melodies, 5 Volume Levels & LED Flash",Lifestyle,Amazon AU2,World,*
