Day of Date Cancelled,Order ID,Order Link,Products Name,Category,Marketplace,Site,Username
"February 13, 2023",59683411,https://all.worldfront.co/axis/orders.php?action=edit&oID=59683411,Food Safe Food Warming Catering Heat lamp 300w 118mm Long,Homeware,Fishpond NZ,NZ,*
"February 13, 2023",903930766,https://all.worldfront.co/axis/orders.php?action=edit&oID=903930766,Golden State Fruit Chocolate Caramel & Crunch Gran cesta de regalo,Arts & Crafts,Amazon MX2,World,*
"February 13, 2023",904739770,https://all.worldfront.co/axis/orders.php?action=edit&oID=904739770,"Retinol Nature Well Clinical Advanced Moisture Cream, Large, 16 oz Tub by Retinol",Beauty,Amazon MX2,World,*
"February 13, 2023",911413168,https://all.worldfront.co/axis/orders.php?action=edit&oID=911413168,"All Natural Tea Tree Eyelid Foaming Cleanser/Wash - We Love Eyes -Blepharitis, Demodex, Dry Eyes Relief and treatment, Wash Eyelashes, Reduce Itching and Inflammation, Paraben & Sulfate Free -50 ml",Beauty,Amazon MX2,World,*
"February 13, 2023",916883928,https://all.worldfront.co/axis/orders.php?action=edit&oID=916883928,Vallejo Metallic Game Color Set (8 Colors),Toys,Amazon MX2,World,*
"February 13, 2023",918814620,https://all.worldfront.co/axis/orders.php?action=edit&oID=918814620,"Kaytee Fiesta Food for Macaw, 4-1/2-Pound Bag",Pets,Amazon MX2,World,*
"February 13, 2023",922464567,https://all.worldfront.co/axis/orders.php?action=edit&oID=922464567,"Managing Legal Compliance in the Health Care Industry [Hardcover] Moseley III, George B.",Books,Amazon US4,World,*
"February 13, 2023",923942336,https://all.worldfront.co/axis/orders.php?action=edit&oID=923942336,(100 ct.) - Petpost Bulldog Wrinkle Wipes for Dogs - Cleans and Soothes Pug Wrinkles and Folds - 100 Ultra Soft Cotton Pads in Coconut Oil Solution,Beauty,Amazon MX2,World,*
"February 13, 2023",926366725,https://all.worldfront.co/axis/orders.php?action=edit&oID=926366725,"Spornette Cerdas de jabalí redondas italianas de 7,62 cm 855",Beauty,Amazon MX2,World,*
"February 13, 2023",928350819,https://all.worldfront.co/axis/orders.php?action=edit&oID=928350819,"Gentle, Sensitive Skin Body Wash. The Only pH 5.5 Balanced Fragrance Free Body Wash for Allergic Skin â?"" Eczema Body Wash for Women and Men, Made with Organic Wild Soapberries, 8.5 ozâ?""by Tree To Tub",Beauty,Amazon MX2,World,*
"February 13, 2023",930432233,https://all.worldfront.co/axis/orders.php?action=edit&oID=930432233,"Wahl Groomsman recortadora de batería para barba y bigote, Recortadora",Beauty,Amazon MX2,World,*
"February 13, 2023",930478969,https://all.worldfront.co/axis/orders.php?action=edit&oID=930478969,"Cica - Crema hidratante facial para mujer, antienvejecimiento, antiarrugas, natural, coreana, 1.68 fl.oz",Beauty,Amazon MX2,World,*
"February 13, 2023",931573726,https://all.worldfront.co/axis/orders.php?action=edit&oID=931573726,"Keranique Scalp Stimulating Shampoo, 8 fl. oz.",Beauty,Amazon MX2,World,*
"February 13, 2023",931613334,https://all.worldfront.co/axis/orders.php?action=edit&oID=931613334,"Retinol Nature Well Clinical Advanced Moisture Cream, Large, 16 oz Tub by Retinol",Beauty,Amazon MX2,World,*
"February 13, 2023",931881895,https://all.worldfront.co/axis/orders.php?action=edit&oID=931881895,"ILIA - Super Serum Skin Tint SPF 40 | Libre de crueldad, vegano, belleza limpia (Sombrio ST2.5)",Beauty,Amazon MX2,World,*
"February 13, 2023",933697635,https://all.worldfront.co/axis/orders.php?action=edit&oID=933697635,"Aceite esencial de hierba de limón, 100% puro y natural, grado terapéutico de primera calidad con cuentagotas de vidrio de alta calidad, enorme 4 onzas líquidas Oz",Beauty,Amazon MX2,World,*
"February 13, 2023",937901957,https://all.worldfront.co/axis/orders.php?action=edit&oID=937901957,"Orly Flash Dry Drops Nail Base Coat, .6 Ounce",Beauty,Amazon MX2,World,*
"February 13, 2023",938192277,https://all.worldfront.co/axis/orders.php?action=edit&oID=938192277,"Vitabath Moisturizing Bath Gelee, Original Spring Green - 21 oz",Beauty,Amazon MX2,World,*
"February 13, 2023",941431904,https://all.worldfront.co/axis/orders.php?action=edit&oID=941431904,Elizavecca hyaluronic acid Water Drop Cream - moisturizer skincare,Beauty,Amazon MX2,World,*
"February 13, 2023",942369760,https://all.worldfront.co/axis/orders.php?action=edit&oID=942369760,"Pure Evening Primrose Oil for Face, Skin, & Hair - Cold Pressed for Greater Efficacy - Great Gift for Mom - Moisturize Dry & Flaky Skin - Fights Aging & Free Radical Damage - Fully Guaranteed By Maple Holistics",Beauty,Amazon MX2,World,*
"February 13, 2023",942975761,https://all.worldfront.co/axis/orders.php?action=edit&oID=942975761,"COLOR WOW EXTRA Mist-ical Shine Spray for All Hair Types, Thermal Protection, 5 oz.",Beauty,Amazon MX2,World,*
"February 13, 2023",943827744,https://all.worldfront.co/axis/orders.php?action=edit&oID=943827744,Cinema Secrets Professional Makeup Brush Cleaner 32oz,Beauty,Amazon MX2,World,*
"February 13, 2023",945115873,https://all.worldfront.co/axis/orders.php?action=edit&oID=945115873,"Cocktail Accessories,Mixnon 48 Pieces Flamingo Cocktail Stirrers Swizzle Sticks Paper Umbrella Picks,for Drinks Wedding Summer Party Music Bar Food Drink Decorations Multicoloured-Disposable Items",Kitchen,Kogan,World,*
"February 13, 2023",947744782,https://all.worldfront.co/axis/orders.php?action=edit&oID=947744782,Alumbre en Polvo Alum Powder 4 oz,Beauty,Amazon MX2,World,*
"February 13, 2023",947802337,https://all.worldfront.co/axis/orders.php?action=edit&oID=947802337,"Aceite esencial de árbol de té hecho a mano, 100% puro y natural, grado terapéutico de primera calidad con cuentagotas de vidrio de alta calidad, enorme 4 onzas líquidas Oz",Beauty,Amazon MX2,World,*
"February 13, 2023",948662622,https://all.worldfront.co/axis/orders.php?action=edit&oID=948662622,Elizavecca hyaluronic acid Water Drop Cream - moisturizer skincare,Beauty,Amazon MX2,World,*
"February 13, 2023",950779274,https://all.worldfront.co/axis/orders.php?action=edit&oID=950779274,"OKAY Honey Nourishing & Strengthening Leave-in Conditioner, 8 Ounce",Beauty,Amazon MX2,World,*
"February 13, 2023",956356625,https://all.worldfront.co/axis/orders.php?action=edit&oID=956356625,"THE BEACH BUM - La crema de tratamiento para eliminar manchas de acné en los glúteos y muslos. Elimina el acné, los granos, los puntos negros, las espinillas, las cuchillas de afeitar y las manchas oscuras de las nalgas y la zona de los muslos. Previene f",Beauty,Amazon MX2,World,*
"February 13, 2023",960534923,https://all.worldfront.co/axis/orders.php?action=edit&oID=960534923,"Aceite esencial de romero hecho a mano, 100% puro y natural, grado terapéutico de primera calidad con cuentagotas de vidrio de alta calidad, enorme 4 fl. Oz",Beauty,Amazon MX2,World,*
"February 13, 2023",963131428,https://all.worldfront.co/axis/orders.php?action=edit&oID=963131428,"Malibu C Swimmers Wellness Shampoo, 33.8 Ounce",Beauty,Amazon MX2,World,*
"February 13, 2023",965732159,https://all.worldfront.co/axis/orders.php?action=edit&oID=965732159,"Retinol Nature Well Clinical Advanced Moisture Cream, Large, 16 oz Tub by Retinol",Beauty,Amazon MX2,World,*
"February 13, 2023",966040197,https://all.worldfront.co/axis/orders.php?action=edit&oID=966040197,"Aceite esencial de romero hecho a mano, 100% puro y natural, grado terapéutico de primera calidad con cuentagotas de vidrio de alta calidad, enorme 4 fl. Oz",Beauty,Amazon MX2,World,*
"February 13, 2023",969353381,https://all.worldfront.co/axis/orders.php?action=edit&oID=969353381,Mrs. Stewart's Bluing 8oz,Homeware,Amazon MX2,World,*
"February 13, 2023",969369249,https://all.worldfront.co/axis/orders.php?action=edit&oID=969369249,"Aceite de coco y argán para el cabello, protector de calor, mezcla en aerosol, sin parabenos ni colorantes, 6.5 onzas líquidas",Beauty,Amazon MX2,World,*
"February 13, 2023",969369249,https://all.worldfront.co/axis/orders.php?action=edit&oID=969369249,"Hair Food Hemp Extract & Manuka Honey Repair Serum, 5.1 fl oz | Hair Repairing Product for Dry, Damaged Hair",Beauty,Amazon MX2,World,*
"February 13, 2023",970011389,https://all.worldfront.co/axis/orders.php?action=edit&oID=970011389,Wahl T-Styler Pro 9686-300 - Cortadora con cable,Beauty,Amazon MX2,World,*
"February 13, 2023",971229861,https://all.worldfront.co/axis/orders.php?action=edit&oID=971229861,Golden State Fruit Chocolate Caramel & Crunch Gran cesta de regalo,Arts & Crafts,Amazon MX2,World,*
"February 13, 2023",973201610,https://all.worldfront.co/axis/orders.php?action=edit&oID=973201610,IROIRO Premium Natural Semi-Permanent Hair Color 20 Iro Purple(8oz) by Iroiro,Beauty,Amazon MX2,World,*
"February 13, 2023",974670504,https://all.worldfront.co/axis/orders.php?action=edit&oID=974670504,"Aceite esencial de menta artesanal - 100% puro y natural de grado terapéutico premium con cuentagotas de vidrio de alta calidad, enorme 4 onzas líquidas Oz",Beauty,Amazon MX2,World,*
"February 13, 2023",975399405,https://all.worldfront.co/axis/orders.php?action=edit&oID=975399405,"Fiebing Sillín de jabón, 3.5 oz, Amarillo",Sports & Outdoors,Amazon MX2,World,*
"February 13, 2023",976159588,https://all.worldfront.co/axis/orders.php?action=edit&oID=976159588,"Nutri-Vet Eye Rinse Liquid for Dogs, 4-Ounce",Pets,Amazon MX2,World,*
"February 13, 2023",980437408,https://all.worldfront.co/axis/orders.php?action=edit&oID=980437408,"Aceite esencial de romero hecho a mano, 100% puro y natural, grado terapéutico de primera calidad con cuentagotas de vidrio de alta calidad, enorme 4 fl. Oz",Beauty,Amazon MX2,World,*
"February 13, 2023",984820131,https://all.worldfront.co/axis/orders.php?action=edit&oID=984820131,"Tea Tree Tea Tree Special Color Shampoo, 10.14 Fl Oz",Beauty,Amazon MX2,World,*
"February 13, 2023",985117454,https://all.worldfront.co/axis/orders.php?action=edit&oID=985117454,Mrs. Stewart's Bluing 8oz,Homeware,Amazon MX2,World,*
"February 13, 2023",988336375,https://all.worldfront.co/axis/orders.php?action=edit&oID=988336375,"Advanced Clinicals Collagen Lifting Body Oil with Vitamin C, Vitamin E fo neck, decollete, upper arms, thighs. 4oz.",Beauty,Amazon MX2,World,*
"February 13, 2023",988602758,https://all.worldfront.co/axis/orders.php?action=edit&oID=988602758,"Majestic Pure Gold Facial Mask, Help Reduces the Appearances of Fine Lines and Wrinkles, Ancient Gold Face Mask Formula - 8.8 Oz",Beauty,Amazon MX2,World,*
"February 13, 2023",989049433,https://all.worldfront.co/axis/orders.php?action=edit&oID=989049433,Schwarzkopf Professional Igora Royal Developer 6% / 20 Volume 33.8 oz,Beauty,Amazon MX2,World,*
"February 13, 2023",990959987,https://all.worldfront.co/axis/orders.php?action=edit&oID=990959987,"Collagen Body Cream Moisturising, Tightening Cellulite Cream Improves Elasticity, Plumps Sagging Skin Body Lotion with Green Tea, Aloe Vera, Chamomile by Reshape, 440ml (440ml)",Beauty,Amazon MX2,World,*
"February 13, 2023",994047590,https://all.worldfront.co/axis/orders.php?action=edit&oID=994047590,Cyanotype Set,Arts & Crafts,Amazon MX2,World,*
"February 13, 2023",996219604,https://all.worldfront.co/axis/orders.php?action=edit&oID=996219604,"Aceite esencial de romero hecho a mano, 100% puro y natural, grado terapéutico de primera calidad con cuentagotas de vidrio de alta calidad, enorme 4 fl. Oz",Beauty,Amazon MX2,World,*
"February 13, 2023",996643601,https://all.worldfront.co/axis/orders.php?action=edit&oID=996643601,"Ownest 10 Colors Liquid Glitter Eyeliner, Metallic Shimmer Glitter Eyeshadow, Long Lasting Waterproof Shimmer Sparkling Eyeliner Eye Shadow-10pcs",Beauty,Amazon MX2,World,*
"February 13, 2023",996877412,https://all.worldfront.co/axis/orders.php?action=edit&oID=996877412,"Collagen Body Cream Moisturising, Tightening Cellulite Cream Improves Elasticity, Plumps Sagging Skin Body Lotion with Green Tea, Aloe Vera, Chamomile by Reshape, 440ml (440ml)",Beauty,Amazon MX2,World,*
"February 11, 2023",56204834,https://all.worldfront.co/axis/orders.php?action=edit&oID=56204834,Panther Vision POWERCAP LED Hat 25/10 Ultra-Bright Hands Free Lighted Battery Powered Headlamp – Unstructured Cotton,Sports & Outdoors,Fishpond NZ,NZ,*
"February 10, 2023",970269642,https://all.worldfront.co/axis/orders.php?action=edit&oID=970269642,"DGQ 100PCS Disposable Plastic Shovel Shape Dessert Spoon Mini for Ice Cream, Pudding, Yoghurt",Kitchen,Catch LAX / JFK,World,*
"February 10, 2023",972696440,https://all.worldfront.co/axis/orders.php?action=edit&oID=972696440,12 x Super Hero Party Bags,Arts & Crafts,Catch LHR,World,*
"February 9, 2023",704547630,https://all.worldfront.co/axis/orders.php?action=edit&oID=704547630,"Taylors of Harrogate Yorkshire Decaf Tea Bags (2 x 80's, Total 160 Tea Bags)",Kitchen,Fishpond AU,AU,*
"February 9, 2023",934959586,https://all.worldfront.co/axis/orders.php?action=edit&oID=934959586,Skin Obsession Jessner's Chemical Peel Kit Anti-ageing and Anti-acne Skin Care Treatment,Beauty,OnBuy,World,*
"February 9, 2023",967953193,https://all.worldfront.co/axis/orders.php?action=edit&oID=967953193,Disney Frozen Musical Adventure Anna Singing Doll,Toys,Catch LAX / JFK,World,*
"February 9, 2023",978558674,https://all.worldfront.co/axis/orders.php?action=edit&oID=978558674,Lambs & Ivy Disney Baby Magical Mickey Mouse Lamp with Shade and Bulb - Gray,Baby,Amazon AU2,World,*
"February 9, 2023",992464764,https://all.worldfront.co/axis/orders.php?action=edit&oID=992464764,Reusable 0.68 Calibre Riot Paintballs - 100 New Re-Usable Rubber Training Elastic Balls Paint Balls,Sports & Outdoors,Kogan,World,*
"February 9, 2023",997992407,https://all.worldfront.co/axis/orders.php?action=edit&oID=997992407,Medique Products 71901 Blood Pressure Cuff,Lifestyle,Kogan,World,*
"February 8, 2023",53360530,https://all.worldfront.co/axis/orders.php?action=edit&oID=53360530,"BIGLIGHT Picture Light Remote Control Wireless Battery Operated Wall Lights, 33cm Rotatable Light Head with 180 Degree Swing Arm and Brightness Dimmer for Indoor Artwork Pictures Diplomas-Black",Homeware,Fishpond NZ,NZ,*
"February 8, 2023",921039598,https://all.worldfront.co/axis/orders.php?action=edit&oID=921039598,Classic Bifocal Outdoor Reading Sunglasses - Comfortable Stylish Simple Readers Rx Magnification,Bags,Kogan,World,*
"February 8, 2023",965166769,https://all.worldfront.co/axis/orders.php?action=edit&oID=965166769,"Grandma's Secret Gooey Remover 2 Ounce - Citrus Strength Goo and Adhesive Remover - Easily Removes Gum, Oil, Crayon, Candle Wax, Glue, Adhesive, Tape and Sticker Residue",Arts & Crafts,Catch LAX / JFK,World,*
"February 8, 2023",977151450,https://all.worldfront.co/axis/orders.php?action=edit&oID=977151450,Scalextric C8434 ARC AIR Powerbase Upgrade Kit. Free Delivery,Toys,eBay AU2,World,*
"February 7, 2023",727587497,https://all.worldfront.co/axis/orders.php?action=edit&oID=727587497,"Fundix by Castey Nonstick Cast Aluminium Induction Fry Pan with Removable Red Handle, 24cm",Kitchen,Fishpond AU,AU,*
"February 7, 2023",735779948,https://all.worldfront.co/axis/orders.php?action=edit&oID=735779948,Light Switch Double 2 Gang - Polished Brass Georgian - Black - Metal Rocker Switch - 10 Amp 2 Gang 2 Way,Homeware,Fishpond AU,AU,*
"February 7, 2023",941110141,https://all.worldfront.co/axis/orders.php?action=edit&oID=941110141,"SinoTrack Vehicle Car GPS Tracker, Anti Lost Alarm Locator Mini Portable Real-Time Location Device, Waterproof Car Motorcycle GPS Tracker Device for Truck Taxi, Support iOS and Android Free Platform",Electronics,Kogan,World,*
"February 7, 2023",947480930,https://all.worldfront.co/axis/orders.php?action=edit&oID=947480930,"100 PCS Jumbo Smoothie Straws, Colourful Disposable Plastic Large Wide-mouthed Milkshake Straw (1.1cm Diameter and 21cm long)",Homeware,Catch LAX / JFK,World,*
"February 7, 2023",948814067,https://all.worldfront.co/axis/orders.php?action=edit&oID=948814067,"Pyle Portable Compact PA Megaphone Speaker with Alarm Siren & Adjustable Volume - 50W Handheld Lightweight Bullhorn - with Mic, AUX in for MP3 & Rechargeable Battery - Indoor Outdoor Use - PMP561LTB",Sports & Outdoors,Kogan,World,*
"February 7, 2023",953015558,https://all.worldfront.co/axis/orders.php?action=edit&oID=953015558,Classic Bifocal Outdoor Reading Sunglasses - Comfortable Stylish Simple Readers Rx Magnification,Bags,Kogan,World,*
"February 7, 2023",960778458,https://all.worldfront.co/axis/orders.php?action=edit&oID=960778458,2 X 15w Universal 300c OVEN COOKER APPLIANCE Bulb Lamp SES E14 Light Bulbs 240V,Homeware,Trade Me,World,*
"February 7, 2023",999808633,https://all.worldfront.co/axis/orders.php?action=edit&oID=999808633,Reusable 0.68 Calibre Riot Paintballs - 100 New Re-Usable Rubber Training Elastic Balls Paint Balls,Sports & Outdoors,Kogan,World,*
"February 6, 2023",976916562,https://all.worldfront.co/axis/orders.php?action=edit&oID=976916562,BlastIR-Link Bi-directional IR extender over Cat5e/6,Electronics,Fishpond World,World,*
"February 5, 2023",794989110,https://all.worldfront.co/axis/orders.php?action=edit&oID=794989110,AZSKY Floating Picture Ledge Display Shelves Decorative Wall Mounted Shelf Home Decor Nursery Bookshelf 90cm Set of 2 Natural Wood,Homeware,Fishpond AU,AU,*
"February 4, 2023",714814752,https://all.worldfront.co/axis/orders.php?action=edit&oID=714814752,Ravensburger UK 33825 Brio Police Van,Toys,Fishpond AU,AU,*
"February 4, 2023",940012482,https://all.worldfront.co/axis/orders.php?action=edit&oID=940012482,"Learning Resources Jumbo Magnetic Lowercase Letters, Multi-Color, Set of 40 Pieces, Ages 3+",Toys,Amazon AU2,World,*
"February 3, 2023",735586875,https://all.worldfront.co/axis/orders.php?action=edit&oID=735586875,"Magnetic Shower Curtain Weights, Rubber Covered Heavy Duty Weights, Prevent Curtain Liner from Blowing Around, Work for Drapery, Tablecloth, Flag, Outdoor Curtain 4 Pairs(Pack of 8)",Homeware,Fishpond AU,AU,*
"February 3, 2023",776294345,https://all.worldfront.co/axis/orders.php?action=edit&oID=776294345,Talking Voice Pedometer with Clock - Red - Count Your Steps and Distance While Exercising,Health,Fishpond AU,AU,*
"February 3, 2023",952992291,https://all.worldfront.co/axis/orders.php?action=edit&oID=952992291,12 X Acoustic Guitars EDIBLE WAFER CARD CAKE TOPPERS STAND UPS,Kitchen,Catch LHR,World,*
"February 3, 2023",986857160,https://all.worldfront.co/axis/orders.php?action=edit&oID=986857160,Oxford Bomber BMX/Skateboard Helmet - Matt Black,Sports & Outdoors,Kogan,World,*
"February 2, 2023",728900218,https://all.worldfront.co/axis/orders.php?action=edit&oID=728900218,"Hen Hamper - 7 Hilarious Hen Party Games (Bubbly Pong, Mr & Mrs, Hen Charades, I Have Never, Who Knows The Bride Best, What Am I, Truth or Dare)",Arts & Crafts,Fishpond AU,AU,*
"February 2, 2023",936329305,https://all.worldfront.co/axis/orders.php?action=edit&oID=936329305,"BAIRONG 4pcs Canning Kit - 2pcs Canning Bubble Popper Bubble Remover and 2pcs Jar Lid Lifter Magnetic Lid Lifter for Canning Tools, Red",Kitchen,Trade Me,World,*
"February 2, 2023",941581207,https://all.worldfront.co/axis/orders.php?action=edit&oID=941581207,Wella SP Men Maxximum Tonic,Beauty,Fishpond World,World,*
"February 2, 2023",987807550,https://all.worldfront.co/axis/orders.php?action=edit&oID=987807550,"Clear Plastic Shot Multi Use Plastic Shot Glasses - 30ml for Indoor Outdoor Use BBQs, Picnics, Weddings and Camping, Beach, Festival Crystal Clear Glasses(30)",Kitchen,Catch LHR,World,*
"February 1, 2023",998479718,https://all.worldfront.co/axis/orders.php?action=edit&oID=998479718,Elizavecca Milky Piggy Wrinkle care Revitalize EGF Retinol Cream for Anti Aging Pore Minimizing Brightening Facial Treatment & Night and Day moisturizing Cream,Beauty,Amazon AU2,World,*
"January 31, 2023",59523340,https://all.worldfront.co/axis/orders.php?action=edit&oID=59523340,Wonder Care Authentic Rudraksh Mala-5face- Genuine Himalayan Rudraksha Seeds Religious Ornament Rosary Japa Mala Necklace - Imported from Nepal,Jewellery,Fishpond NZ,NZ,*
"January 31, 2023",925198705,https://all.worldfront.co/axis/orders.php?action=edit&oID=925198705,"Retro Rewind Polarized Sunglasses for Men Women UV Protection Classic Sun Glasses, Matte White | Smoke, One size fits most",Bags,Amazon AU2,World,*
"January 31, 2023",942416957,https://all.worldfront.co/axis/orders.php?action=edit&oID=942416957,Universal Travel Power Adapter-All in One Worldwide International Wall Charger AC Plug Adaptor with 5.6A Smart Power USB and 3.0A USB Type-C for USA EU UK AUS Cell Phone Laptop (Rose Gold),Lifestyle,Amazon AU2,World,*
"January 31, 2023",953773680,https://all.worldfront.co/axis/orders.php?action=edit&oID=953773680,"Agapanthus African Llily, Lily Of The Nile Liquid Fertiliser Hightech Npk, Root,",Homeware,Fishpond World,World,*
"January 31, 2023",964757907,https://all.worldfront.co/axis/orders.php?action=edit&oID=964757907,"Shower Massage Head With Mist - High Pressure Boosting, Multi-Function, Massager Rainfall Showerhead For Low Flow Showers & Adjustable Water Saving Nozzle, 2.5 GPM - Brushed Nickel",Homeware,Kogan,World,*
"January 31, 2023",966272982,https://all.worldfront.co/axis/orders.php?action=edit&oID=966272982,"Gelish Professional Curls & Pearls Gel Polish, Pale Pink Creme",Beauty,Amazon AU2,World,*
"January 31, 2023",969946542,https://all.worldfront.co/axis/orders.php?action=edit&oID=969946542,Classic Bifocal Outdoor Reading Sunglasses - Comfortable Stylish Simple Readers Rx Magnification,Bags,Kogan,World,*
"January 31, 2023",984888782,https://all.worldfront.co/axis/orders.php?action=edit&oID=984888782,Switchblade Spring Folding Knife Push Button Pocket Comb Oil Hair Styling(02),Beauty,Kogan,World,*
"January 30, 2023",958313162,https://all.worldfront.co/axis/orders.php?action=edit&oID=958313162,compatible with compatible with compatible with compatible with compatible with compatible with compatible with compatible with compatible with compatible with compatible with compatible with compatible with compatible with compatible with compatible with,Electronics,Fishpond World,World,*
"January 30, 2023",960980679,https://all.worldfront.co/axis/orders.php?action=edit&oID=960980679,Pinecar Cool Blue Metallic Complete Paint System,Toys,OnBuy,World,*
"January 30, 2023",961485611,https://all.worldfront.co/axis/orders.php?action=edit&oID=961485611,"Dunamis 4pk 1/3AAA Rechargeable Solar Light Batteries 1.2v NiMH 1/3AAA 80mAh - ** 1/3 AAA Size ** For Garden Solar Lights…***THESE ARE NOT STANDARD AAA SIZE BUT ""ONE THIRD"" AAA OR 1/3 AAA SIZE***",Electronics,Fishpond World,World,*
"January 29, 2023",748236797,https://all.worldfront.co/axis/orders.php?action=edit&oID=748236797,My Fairy Garden Tree Hollow Toy,Toys,Fishpond AU,AU,*
"January 29, 2023",777109228,https://all.worldfront.co/axis/orders.php?action=edit&oID=777109228,PlayMonster My Fairy Garden Bean Blossom Playset,Toys,Fishpond AU,AU,*
"January 29, 2023",934959639,https://all.worldfront.co/axis/orders.php?action=edit&oID=934959639,Kastar intelligent mini travel Charger (with high speed portable USB charge function) for PDA Camera Li-ion Battery Digital cameras Mp3 Mp4 players Hand held gaming devices PDAs,Electronics,Amazon AU2,World,*
"January 29, 2023",936425285,https://all.worldfront.co/axis/orders.php?action=edit&oID=936425285,Hilitchi 150pcs Fast-blow Glass Fuses Quick Blow Car Glass Tube Fuses Assorted Kit Amp,Homeware,Trade Me,World,*
"January 29, 2023",944862567,https://all.worldfront.co/axis/orders.php?action=edit&oID=944862567,"ALEKO LIMITSWITCH2 Limit Switches for Swing Gate Opener, Short and Long Wire",Homeware,Kogan,World,*
"January 29, 2023",982413979,https://all.worldfront.co/axis/orders.php?action=edit&oID=982413979,"Crescent Moon Shelf Wall Decor - Rustic Wooden Moon Shelf for Crystals, Stones & Essential Oils - Wall-Mounted & Easy to Hang - Boho Shelf for Nursery or Bedrooms - 14 x 36cm x 8.9cm . (Dark Brown)",Homeware,Kogan,World,*
"January 29, 2023",996018496,https://all.worldfront.co/axis/orders.php?action=edit&oID=996018496,"Woolino Naptime & Play Rug for Babies, 100% Natural Australian Lambskin, Hypoallergenic Sheepskin, 2 x 3 Feet, Ivory",Baby,Amazon AU2,World,*
"January 28, 2023",960966934,https://all.worldfront.co/axis/orders.php?action=edit&oID=960966934,Durance Scented Bouquet - White Camellia 100ml/3.4oz,Beauty,Fishpond World,World,*
"January 27, 2023",926041819,https://all.worldfront.co/axis/orders.php?action=edit&oID=926041819,Anew Platinum Set,Beauty,Fishpond World,World,*
"January 27, 2023",932973078,https://all.worldfront.co/axis/orders.php?action=edit&oID=932973078,500g Foil Wrapped Chocolate Hearts - Red,Homeware,Catch LHR,World,*
"January 27, 2023",983400051,https://all.worldfront.co/axis/orders.php?action=edit&oID=983400051,Dremisland Handmade Grey Feather Dream Catcher Car Interior Rearview Pendant Charm Car Hanging(Grey Circle),Homeware,Kogan,World,*
"January 27, 2023",996265370,https://all.worldfront.co/axis/orders.php?action=edit&oID=996265370,"super-cute Pepper Spray & Lipstick Stun Gun Kit - Professional Grade, Maximum Strength Pepper Spray & Compact Stun Gun with LED Flashlight & Rechargeable Battery - Black & Black",Sports & Outdoors,Kogan,World,*
"January 27, 2023",998042135,https://all.worldfront.co/axis/orders.php?action=edit&oID=998042135,"Refrigerator Magnets,100PCS 6X3MM Small Round Cylinder Fridge Magnets, Office Magnets, Whiteboard Magnets, Map Magnets",Kitchen,Catch LAX / JFK,World,*
"January 26, 2023",52657706,https://all.worldfront.co/axis/orders.php?action=edit&oID=52657706,Elite Coffee - Turkish - 100ml,Kitchen,Fishpond NZ,NZ,*
"January 26, 2023",916365303,https://all.worldfront.co/axis/orders.php?action=edit&oID=916365303,BABEYOND Roaring 20s Vintage Style Folding Handheld Flapper Marabou Feather Hand Fan for Costume Halloween Dancing Party Tea Party Variety Show (Off White),Homeware,Catch LAX / JFK,World,*
