"August 29, 2022",700808749,https://all.worldfront.co/axis/orders.php?action=edit&oID=700808749,"Unived Gel, 26g Carbohydrates, 363mg Electrolytes, 200mg Beta-Alanine, 110kcal, Vegan & Gluten-Free (Salted Caramel (6 Pack))",Health,Fishpond AU,AU,*
"August 29, 2022",700808749,https://all.worldfront.co/axis/orders.php?action=edit&oID=700808749,"Unived Gel, 26g Carbohydrates, 363mg Electrolytes, 200mg Beta-Alanine, 110kcal, Vegan & Gluten-Free (Salted Lime (6 Pack))",Health,Fishpond AU,AU,*
"August 29, 2022",704248098,https://all.worldfront.co/axis/orders.php?action=edit&oID=704248098,Integrative Therapeutics - Lavela WS 1265 - Clinically Studied Lavender Oil to Reduce Occasional Anxiety - Non-Habit Forming - 60 Softgels,Health,Fishpond AU,AU,*
"August 29, 2022",710632129,https://all.worldfront.co/axis/orders.php?action=edit&oID=710632129,"Zion Judaica Transitional Grace Hanukkah Menorah with 45 Hanukkah Candles, 6 Dreidels. Hanukkah Guide a Sack of Chocolate Gelt (Satin Gold)",Homeware,Fishpond AU,AU,*
"August 29, 2022",741932889,https://all.worldfront.co/axis/orders.php?action=edit&oID=741932889,"Bronson Ginkgo Biloba 500 mg Extra Strength 500 mg per Serving - Supports Brain Function & Memory Support, 120 Vegetarian Capsules",Health,Fishpond AU,AU,*
"August 29, 2022",768320609,https://all.worldfront.co/axis/orders.php?action=edit&oID=768320609,"Dap 18354 Seal 'N Peel Removable Caulk, 299ml",Lifestyle,Fishpond AU,AU,*
"August 29, 2022",784619097,https://all.worldfront.co/axis/orders.php?action=edit&oID=784619097,"(2 Pack) Botanical Farms Gummies, Extra Strength, 2 Bottle Package, 60 Day Supply",Health,Fishpond AU,AU,*
"August 28, 2022",57162416,https://all.worldfront.co/axis/orders.php?action=edit&oID=57162416,Ekena CM18RO 46cm Outer Diameter x 8.9cm Inner Diameter x 3.8cm Projection Rose Ceiling Medallion - Primed,Homeware,Fishpond NZ,NZ,*
"August 28, 2022",57162416,https://all.worldfront.co/axis/orders.php?action=edit&oID=57162416,"Ekena Millwork CM13TI Tirana Ceiling Medallion, 35cm OD x 9.5cm ID x 3.2cm P (Fits Canopies up to 12cm ), Factory Primed",Homeware,Fishpond NZ,NZ,*
"August 28, 2022",57162416,https://all.worldfront.co/axis/orders.php?action=edit&oID=57162416,Ekena Millwork CM18RL 46cm OD x 8.9cm ID x 3.8cm Riley Ceiling Medallion,Homeware,Fishpond NZ,NZ,*
"August 28, 2022",57162416,https://all.worldfront.co/axis/orders.php?action=edit&oID=57162416,Ekena Millwork CM18SK 47cm OD x 2.9cm ID x 3.8cm Sellek Ceiling Medallion,Homeware,Fishpond NZ,NZ,*
"August 28, 2022",91889886,https://all.worldfront.co/axis/orders.php?action=edit&oID=91889886,Graffiti Decal Bong 26cm Tall Acrylic (Blue),Kitchen,Kogan,World,*
"August 28, 2022",91891969,https://all.worldfront.co/axis/orders.php?action=edit&oID=91891969,Black Dog Fob Watch Great Midwife Nurse Gift Present,Health,Kogan,World,*
"August 28, 2022",96271316,https://all.worldfront.co/axis/orders.php?action=edit&oID=96271316,Eldnacele Flameless Flickering Waterproof Candles All Weather Battery Operated LED Candles with Remote Control and Timer Heat Reistant Candles for Outdoor & Indoor Decoration Set of 3,Homeware,Kogan,World,*
"August 28, 2022",97098989,https://all.worldfront.co/axis/orders.php?action=edit&oID=97098989,PGA Tour Shoe Bag With Club Cleaning Set,Sports & Outdoors,Catch LHR,World,*
"August 28, 2022",97272079,https://all.worldfront.co/axis/orders.php?action=edit&oID=97272079,Permatex 33345 S-33 2 Tonne Crystal Clear Epoxy,Homeware,Fishpond World,World,*
"August 28, 2022",99102235,https://all.worldfront.co/axis/orders.php?action=edit&oID=99102235,"Gorilla Grip PEVA Shower Curtain, 72x48, Heavy Duty Thick Waterproof Bathroom Plastic Curtains, Weighted Magnets, Rust Resistant Grommets, Fits Standard Bath Tub and Showers, Single, Clear",Homeware,Catch LAX / JFK,World,*
"August 28, 2022",703508288,https://all.worldfront.co/axis/orders.php?action=edit&oID=703508288,"Fortero Carbonic Acid Shampoo for Hair Growth and Treating Hair Loss　- PACKAGE- Thickening Hair Growth Shampoo for Men and Women with Thin, Dry or Damaged Hair – Anti Dandruff - (Quantity, 3 bottles)",Beauty,Fishpond AU,AU,*
"August 28, 2022",717985402,https://all.worldfront.co/axis/orders.php?action=edit&oID=717985402,Prince Lionheart Ultimate Wipes Warmer,Baby,Fishpond AU,AU,*
"August 28, 2022",739760429,https://all.worldfront.co/axis/orders.php?action=edit&oID=739760429,Pentair 42002-0024S Stack Flue Sensor Replacement Pool and Spa Heater Electrical Systems,Sports & Outdoors,Fishpond AU,AU,*
"August 28, 2022",776884223,https://all.worldfront.co/axis/orders.php?action=edit&oID=776884223,"VonShef Electric Plate Warmer, Double Insulated Sleeve Heats up to 10 Full Size Dinner Plates, Removable and Washable Cotton Sleeves Ideal for Dinner Parties, Christmas Dinner or Buffets - Grey",Kitchen,Fishpond AU,AU,*
"August 28, 2022",799250377,https://all.worldfront.co/axis/orders.php?action=edit&oID=799250377,Wrigley.s Extra Sugar Free Gum Sweet Watermelon,Health,Fishpond AU,AU,*
"August 27, 2022",704914691,https://all.worldfront.co/axis/orders.php?action=edit&oID=704914691,"New brothread 84 Spools 360° Fully Rotating Wooden Thread Rack/Thread Holder Organiser for Sewing, Quilting, Embroidery, Hair-braiding and Jewellery",Arts & Crafts,Fishpond AU,AU,*
"August 27, 2022",735105715,https://all.worldfront.co/axis/orders.php?action=edit&oID=735105715,"BCM 95 also known as BIOCURCUMAX IS THE WORLD’S MOST PREFERRED, AWARD WINNING, 100% PURE TURMERIC EXTRACT.",Health,Fishpond AU,AU,*
"August 27, 2022",739276387,https://all.worldfront.co/axis/orders.php?action=edit&oID=739276387,"Fortero Carbonic Acid Shampoo for Hair Growth and Treating Hair Loss　- PACKAGE- Thickening Hair Growth Shampoo for Men and Women with Thin, Dry or Damaged Hair – Anti Dandruff - (Quantity, 3 bottles)",Beauty,Fishpond AU,AU,*
"August 27, 2022",741601952,https://all.worldfront.co/axis/orders.php?action=edit&oID=741601952,"Fasting Salts: Sodium, Potassium, Magnesium, for Intermittent and Extended Fasting. Zero Additives: Free from All Fillers, Flavourings, Sugar, Sweeteners, Gluten. 400g.",Health,Fishpond AU,AU,*
"August 26, 2022",51465651,https://all.worldfront.co/axis/orders.php?action=edit&oID=51465651,"AAVALABS® Triple Zinc - High Strength - 25mg per Serving - Full Spectrum Blend - 180 Tablets - 3X Forms of Zinc - Picolinate, Bisglycinate Monomethionine",Health,Fishpond NZ,NZ,*
"August 26, 2022",51782964,https://all.worldfront.co/axis/orders.php?action=edit&oID=51782964,ReMag Pico-Ionic Liquid Magnesium by RnA ReSet. Formulated by Dr. Carolyn Dean for Complete Absorption. Experience The Magnesium Miracle. 480ml,Health,Fishpond NZ,NZ,*
"August 26, 2022",51817677,https://all.worldfront.co/axis/orders.php?action=edit&oID=51817677,"GROHE 46312IE0 Pull Out Spray, No Finish",Lifestyle,Fishpond NZ,NZ,*
"August 26, 2022",56898184,https://all.worldfront.co/axis/orders.php?action=edit&oID=56898184,Nettle Leaf - Urtica dioica Dried Loose Leaf 100% from Nature (30ml),Health,Fishpond NZ,NZ,*
"August 26, 2022",92335869,https://all.worldfront.co/axis/orders.php?action=edit&oID=92335869,"Edible Gold Leaf Sheets 30pc M-size 24 Karat 3cm X 3cm Genuine for Cooking, Cakes & Chocolates, Decoration, Health & Spa",Arts & Crafts,Kogan,World,*
"August 26, 2022",92335869,https://all.worldfront.co/axis/orders.php?action=edit&oID=92335869,"GoldleafKing | 0.6” Extra Small 24k Gold Edible Gold Leaf Sheets - 30 sheets | Sweets Edition - Small for all Sweet | edible cake decorations, gold sheets | + Free 3 Silver Leaf Sheet",Arts & Crafts,Kogan,World,*
"August 26, 2022",96618452,https://all.worldfront.co/axis/orders.php?action=edit&oID=96618452,Generic Cr2032 Br2032 2032 3V Lithium Batteries 20 Pcs 4 Cards FBA,Homeware,Trade Me,World,*
"August 26, 2022",709308738,https://all.worldfront.co/axis/orders.php?action=edit&oID=709308738,24 Muppets Cupcake Toppers,Kitchen,Fishpond AU,AU,*
"August 26, 2022",756705058,https://all.worldfront.co/axis/orders.php?action=edit&oID=756705058,BaBylissMEN Japanese Steel Digital Hair Clipper,Health,Fishpond AU,AU,*
"August 26, 2022",761821091,https://all.worldfront.co/axis/orders.php?action=edit&oID=761821091,"AUTENS Wireless Doorbell, Waterproof Door Bell Chime Kit Battery Operated 36 Melodies 4 Level Volume 300m Long Range LED Indicator for Home Classroom Office (2 Receiver,1 Transmiter)",Lifestyle,Fishpond AU,AU,*
"August 26, 2022",796527461,https://all.worldfront.co/axis/orders.php?action=edit&oID=796527461,"NEW SuperEar RECHARGEABLE Sound Amplifier Assistive Listening Device Increases Sound 50dB, 3 Tone Frequency Selection, Discreet Earbuds",Health,Fishpond AU,AU,*
"August 25, 2022",55925873,https://all.worldfront.co/axis/orders.php?action=edit&oID=55925873,Angelus Brand Leather Dye - Jet Black - 90ml,Shoes,Fishpond NZ,NZ,*
"August 25, 2022",57182966,https://all.worldfront.co/axis/orders.php?action=edit&oID=57182966,The Ginger People 42g Ginger Chews,Health,Fishpond NZ,NZ,*
"August 25, 2022",59219908,https://all.worldfront.co/axis/orders.php?action=edit&oID=59219908,Lean Belly Juice Drink Supplement (2 Pack),Health,Fishpond NZ,NZ,*
"August 25, 2022",90810075,https://all.worldfront.co/axis/orders.php?action=edit&oID=90810075,48 x gruffalo wafer cupcake cake toppers,Kitchen,Trade Me,World,*
"August 25, 2022",91439519,https://all.worldfront.co/axis/orders.php?action=edit&oID=91439519,"Dykem 80300 Steel Blue Layout Fluid, Brush-in-Cap (4oz)",Electronics,Amazon MX2,World,*
"August 25, 2022",91644408,https://all.worldfront.co/axis/orders.php?action=edit&oID=91644408,"SCHLAGE BR400 Sense Wi-Fi Adapter (2.4GHz WiFi Only) | Works with SCHLAGE Sense, White",Lifestyle,Amazon AU2,World,*
"August 25, 2022",92707832,https://all.worldfront.co/axis/orders.php?action=edit&oID=92707832,E27 to B22 Screw LED Light Bulb Socket Enlarger Adapter Holder,Homeware,Catch LHR,World,*
"August 25, 2022",96268402,https://all.worldfront.co/axis/orders.php?action=edit&oID=96268402,BULUSHI 100W 100 ohm Resistance Screw Mount Aluminium Shell Wirewound Resistor Green (100W-100ΩJ),Lifestyle,Trade Me,World,*
"August 25, 2022",96288661,https://all.worldfront.co/axis/orders.php?action=edit&oID=96288661,"Brightech- LightView Pro Flex: LED Magnifying Lamp - 2 in 1 Clamp & Base Lamp for Table, Desk & Easel - Ultra Bright Daylight Light. Great for Reading, Hobbies, Crafts, Workbench- White",Toys,Amazon AU2,World,*
"August 25, 2022",97314342,https://all.worldfront.co/axis/orders.php?action=edit&oID=97314342,"TP-Link TL-PoE150S Gigabit PoE Injector Adapter, IEEE 802.3af compliant, Plug & Play, Convert Non-PoE to PoE Adapter, Auto Detects the Required Power (up to 15.4W), Up to 100 meters (328 Feet)",Electronics,Amazon CA2,World,*
"August 25, 2022",98194910,https://all.worldfront.co/axis/orders.php?action=edit&oID=98194910,TickiT Ultra Bright LED Light Panel - In Home Learning Supplies for Sensory Play - Adjustable Brightness - Color and Shape Exploration on a Light Box,Toys,Amazon US1,World,*
"August 25, 2022",711183391,https://all.worldfront.co/axis/orders.php?action=edit&oID=711183391,"Turmeric Tablets 2000mg Extract High Strength with Black Pepper & Ginger (1 Year Supply) Active 95% Turmeric Curcumin Supplements , Vegan, GMP, GMO Free Gluten Free, UK Made by New Leaf",Health,Fishpond AU,AU,*
"August 25, 2022",712255370,https://all.worldfront.co/axis/orders.php?action=edit&oID=712255370,Quimica Alemana Nail Hardener 15ml (Pack of 3) w/Free Nail File,Beauty,Fishpond AU,AU,*
"August 25, 2022",720323061,https://all.worldfront.co/axis/orders.php?action=edit&oID=720323061,"Retinol Anti-Ageing Hand Cream – The Original Retinol Brand For Younger Looking Hands –Rich, Velvety Hand Cream Conditions & Protects Skin, Nails & Cuticles – Vitamin A Minimises Age’s Effect on Skin (cucumber scent)",Beauty,Fishpond AU,AU,*
"August 25, 2022",738233974,https://all.worldfront.co/axis/orders.php?action=edit&oID=738233974,"eBuyGB Inflatable Beach Lounge Chair, Blue",Toys,Fishpond AU,AU,*
"August 25, 2022",760537651,https://all.worldfront.co/axis/orders.php?action=edit&oID=760537651,EltaMD UV Elements Broad-Spectrum SPF 44 Tinted 60ml,Beauty,Fishpond AU,AU,*
"August 24, 2022",50788786,https://all.worldfront.co/axis/orders.php?action=edit&oID=50788786,Work Sharp Knife & Tool Sharpener Mk.2,Kitchen,Fishpond NZ,NZ,*
"August 24, 2022",53961722,https://all.worldfront.co/axis/orders.php?action=edit&oID=53961722,Zig PS220P-010 Zig Photo Signature Marker -Packaged-Black,Toys,Fishpond NZ,NZ,*
"August 24, 2022",57155351,https://all.worldfront.co/axis/orders.php?action=edit&oID=57155351,"seveni Hair Dryer Perm Heating Colour Processor, Hairdresser Styling Timer Hairdressing Equipment for Barber Salon",Beauty,Fishpond NZ,NZ,*
"August 24, 2022",91156702,https://all.worldfront.co/axis/orders.php?action=edit&oID=91156702,"Aroma Housewares NutriWare 14-Cup (Cooked) Digital Rice Cooker and Food Steamer, White",Kitchen,Amazon AU2,World,*
"August 24, 2022",92179783,https://all.worldfront.co/axis/orders.php?action=edit&oID=92179783,"Best Probiotics for Dogs with Acidophilus Improves Dog Constipation, Gas, Dog Diarrhoea, Bad Breath, Allergies, All Natural Dog Probiotic Powder, 5 Billion CFUs, Probiotics for Puppies to Seniors",Pets,Catch LAX / JFK,World,*
"August 24, 2022",93258940,https://all.worldfront.co/axis/orders.php?action=edit&oID=93258940,"AHEVO G4 LED Light Bulbs,G4 Mini Capsule Bulbs, White 2W AC DC12V, Equal to 15W Halogen Lamps(6000K,10pcs)",Homeware,Kogan,World,*
"August 24, 2022",94701980,https://all.worldfront.co/axis/orders.php?action=edit&oID=94701980,"Cuisinart CSB-175SV Smart Stick hand blender, 2018, Silver",Kitchen,Amazon AU2,World,*
"August 24, 2022",95531221,https://all.worldfront.co/axis/orders.php?action=edit&oID=95531221,Akemi Triple Effect 500 ML,Health,Fishpond World,World,*
"August 24, 2022",97824412,https://all.worldfront.co/axis/orders.php?action=edit&oID=97824412,"Fabric Shower Curtain or Liner with Magnets - Hotel Quality, Machine Washable, Water Repellent - White, 72x72",Homeware,Kogan,World,*
"August 24, 2022",98769130,https://all.worldfront.co/axis/orders.php?action=edit&oID=98769130,"INNOTECK Teardrop Pendant Light Shade, Steel",Lifestyle,Kogan,World,*
"August 24, 2022",718656090,https://all.worldfront.co/axis/orders.php?action=edit&oID=718656090,Pumpkin Pie Fragrance Oil - Premium Grade Scented Oil - 10ml,Beauty,Fishpond AU,AU,*
"August 24, 2022",737746173,https://all.worldfront.co/axis/orders.php?action=edit&oID=737746173,"K3 Spark Mineral Pills by Zelso Nutrition, Advanced K3Spark Pill Formula for Men and Women - Emily, 30 Day Supply (60 Capsules)",Health,Fishpond AU,AU,*
"August 24, 2022",767192504,https://all.worldfront.co/axis/orders.php?action=edit&oID=767192504,8 x Moth Proof Sweater Storage Bags UK made (w/Acana Moth Killer Sachets),Homeware,Fishpond AU,AU,*
"August 24, 2022",797948218,https://all.worldfront.co/axis/orders.php?action=edit&oID=797948218,Go Keto Gummies - Go Keto Pills - GoKeto Gummies for Weight Management (60 Gummies - 1 Month Supply),Health,Fishpond AU,AU,*
"August 23, 2022",93399472,https://all.worldfront.co/axis/orders.php?action=edit&oID=93399472,"3 x EUNICELL CR1/3N, DL1/3N, 2L76 3v PHOTO LITHIUM BATTERY",Electronics,Fishpond World,World,*
"August 23, 2022",93399472,https://all.worldfront.co/axis/orders.php?action=edit&oID=93399472,"Duracell DL1/3N Photo Lithium Batterie CR1/3N, 2L76",Electronics,Fishpond World,World,*
"August 23, 2022",94683815,https://all.worldfront.co/axis/orders.php?action=edit&oID=94683815,ANZENSHI LED Desk Lamp Eye-Caring Metal Table Lamps Dimmable Office Lamp with USB and Type C Charging Port 3 Lighting Modes with Stepless Brightness Adjustment 7W Black,Lifestyle,Kogan,World,*
"August 23, 2022",97152074,https://all.worldfront.co/axis/orders.php?action=edit&oID=97152074,Chg Gal Teat Dip,Pets,Fishpond World,World,*
"August 23, 2022",98815038,https://all.worldfront.co/axis/orders.php?action=edit&oID=98815038,GUMBALL VENDING MACHINE DISPENSER SWEET BUBBLEGUM FUN KIDS TOY CHEWING GUM NEW,Toys,Trade Me,World,*
"August 22, 2022",59578467,https://all.worldfront.co/axis/orders.php?action=edit&oID=59578467,"Jah B Coffee | Jamaican Blue Mountain Whole Coffee Beans/Medium Roast, Single Origin, Grade A | 240ml Bag",Kitchen,Fishpond NZ,NZ,*
"August 22, 2022",59719933,https://all.worldfront.co/axis/orders.php?action=edit&oID=59719933,Eden Classics - Rapport - Body Care - 10ml - Male,Beauty,Fishpond NZ,NZ,*
"August 22, 2022",93369897,https://all.worldfront.co/axis/orders.php?action=edit&oID=93369897,Die Hard Christmas Ornament: Lights Up! by Running Press,Toys,eBay AU2,World,*
"August 22, 2022",93537411,https://all.worldfront.co/axis/orders.php?action=edit&oID=93537411,"Witch Bells Protection Door Hanger, Handmade Witch Bells Wreath, Magic Home Protection, Wiccan Magic Wind Chimes for Positivity and Wealth, Wicca Decor, Witchcraft Wicca Gift Bell (Beads Witch Bell)",Homeware,Trade Me,World,*
"August 22, 2022",95469398,https://all.worldfront.co/axis/orders.php?action=edit&oID=95469398,hOmeLabs Sunrise Alarm Clock - Digital LED Clock with 6 Color Switch and FM Radio for Bedrooms - Multiple Nature Sounds Sunset Simulation & Touch Control - with Snooze Function for Heavy Sleepers,Homeware,Amazon AU2,World,*
"August 22, 2022",707077081,https://all.worldfront.co/axis/orders.php?action=edit&oID=707077081,"Seattle's Best Coffee K-Cups, Toasty Hazelnut 10ml (Pack of 1)",Kitchen,Fishpond AU,AU,*
"August 22, 2022",712467883,https://all.worldfront.co/axis/orders.php?action=edit&oID=712467883,A Memorable One Bien Etre Colonia Eau Fraiche 250 ml Pack of 1 x 250 ml),Beauty,Fishpond AU,AU,*
"August 22, 2022",784289482,https://all.worldfront.co/axis/orders.php?action=edit&oID=784289482,Die Hard Christmas Ornament: Lights Up!,Toys,Fishpond AU,AU,*
"August 21, 2022",52094343,https://all.worldfront.co/axis/orders.php?action=edit&oID=52094343,Happyyami Tofu Press Mould Box Homemade Wooden Tofu Maker Tofu Cheese Maker DIY Water Tofu Mould Tofu Making Kit for Kitchen Home,Kitchen,Fishpond NZ,NZ,*
"August 21, 2022",54562721,https://all.worldfront.co/axis/orders.php?action=edit&oID=54562721,(3 Pack) Keto Advantage Keto Burn Weight Management Pills 1500 for Diabetics BHB Ketogenic Advanced Ketosis Formula (180 Capsules),Health,Fishpond NZ,NZ,*
"August 21, 2022",57190253,https://all.worldfront.co/axis/orders.php?action=edit&oID=57190253,MANDATE Men's Duo Grooming Gift Set,Beauty,Fishpond NZ,NZ,*
"August 21, 2022",90756737,https://all.worldfront.co/axis/orders.php?action=edit&oID=90756737,Bell Automotive 22-1-29001-8 Digital Compass and Mirror Mount,Homeware,Kogan,World,*
"August 21, 2022",92824157,https://all.worldfront.co/axis/orders.php?action=edit&oID=92824157,"A-ZOOM, Rifle Metal Snap Caps, 308 Winchester, Per 2",Sports & Outdoors,Trade Me,World,*
"August 21, 2022",93876229,https://all.worldfront.co/axis/orders.php?action=edit&oID=93876229,"N.P Hydrogen Water Bottle Generator with Dual Chamber,PEM and SPE Technology,Up to 1700PPB,Portable Hydrogen Water Maker,Hydrogen Water Machine,New Technology Glass (a)",Kitchen,Kogan,World,*
"August 21, 2022",93951744,https://all.worldfront.co/axis/orders.php?action=edit&oID=93951744,"Professional Boot & Shoe Leather Stretch - Stretch Tight Fitting Leather, Suede and Vinyl Shoes or Boots - 120ml",Shoes,Kogan,World,*
"August 21, 2022",97764398,https://all.worldfront.co/axis/orders.php?action=edit&oID=97764398,"Jelly Belly My Favourites Jelly Bean Machine, Dispenser, Genuine, Official, Straight from the Source",Kitchen,Catch LAX / JFK,World,*
"August 21, 2022",99862523,https://all.worldfront.co/axis/orders.php?action=edit&oID=99862523,Vanicream SPF 35 Sport Sunscreen 120ml,Beauty,Kogan,World,*
"August 21, 2022",736075531,https://all.worldfront.co/axis/orders.php?action=edit&oID=736075531,Personalised Steam Train 19cm High Resolution Cake Topper,Kitchen,Fishpond AU,AU,*
"August 21, 2022",753219810,https://all.worldfront.co/axis/orders.php?action=edit&oID=753219810,(5 Pack) Keto F1 Pills Advanced Ketogenic Support Shark Keto Tank (300 Capsules),Health,Fishpond AU,AU,*
"August 21, 2022",769509231,https://all.worldfront.co/axis/orders.php?action=edit&oID=769509231,Elta MD UV Clear Broad Spectrum SPF 46 50ml/48g,Lifestyle,Fishpond AU,AU,*
"August 21, 2022",769509231,https://all.worldfront.co/axis/orders.php?action=edit&oID=769509231,"EltaMD UV Sport Sunscreen Lotion, Broad-Spectrum SPF 50, Non-Greasy, Mineral-Based Zinc Oxide Formula, Water-Resistant",Beauty,Fishpond AU,AU,*
"August 20, 2022",50191555,https://all.worldfront.co/axis/orders.php?action=edit&oID=50191555,"Citrucel® Methylcellulose Fibre, 240 Caplets",Beauty,Fishpond NZ,NZ,*
"August 20, 2022",56666615,https://all.worldfront.co/axis/orders.php?action=edit&oID=56666615,"The Skinny Food Co Barista Zero Calorie Syrup, Pumpkin Spice",Kitchen,Fishpond NZ,NZ,*
"August 20, 2022",92511222,https://all.worldfront.co/axis/orders.php?action=edit&oID=92511222,"Cuisinart GR-4NP1 5-in-1 Griddler, 13.5""(L) x 11.5""(W) x 7.12""(H), Silver With Silver/Black Dials",Toys,Amazon SA1,World,*
"August 20, 2022",93229969,https://all.worldfront.co/axis/orders.php?action=edit&oID=93229969,TP-LINK TL-R470T+ Load Balance Broadband Router,Electronics,Amazon CA2,World,*
"August 20, 2022",94193200,https://all.worldfront.co/axis/orders.php?action=edit&oID=94193200,200 PCS Christmas Pine Cones Natural Mini Pine Cones Thanksgiving Pine Cones Bulk Christmas Pinecones Ornaments for Home Decoration DIY Crafts Wedding Christmas Tree Fall Winter Decor,Homeware,Kogan,World,*
"August 20, 2022",94193200,https://all.worldfront.co/axis/orders.php?action=edit&oID=94193200,"Deloky 250 PCS Christmas Natural Mini Pine Cones-Thanksgiving Pinecones Ornaments for DIY Crafts, Home Decorations,Fall and Christmas,Wedding Decor",Homeware,Kogan,World,*
"August 20, 2022",94193200,https://all.worldfront.co/axis/orders.php?action=edit&oID=94193200,"Deloky 1000 PCS Christmas Natural Mini Pine Cones-Thanksgiving Pinecones Ornaments for DIY Crafts, Home Decorations ,Christmas and Fall,Wedding Decor (1000 Pcs)",Homeware,Kogan,World,*
"August 20, 2022",96095210,https://all.worldfront.co/axis/orders.php?action=edit&oID=96095210,Blagdon 2751 Feature Lavender Scent For Water Features,Homeware,Fishpond World,World,*
"August 20, 2022",714272039,https://all.worldfront.co/axis/orders.php?action=edit&oID=714272039,Bcb CN336 Fire Dragon Solid Camp Cooking Fuel 27g 10 Packs of 6 (60),Sports & Outdoors,Fishpond AU,AU,*
"August 20, 2022",739461940,https://all.worldfront.co/axis/orders.php?action=edit&oID=739461940,"(2 Pack) K3 Spark Mineral Pills by Zelso Nutrition, Advanced K3Spark Pill Formula for Men and Women - Emily, 60 Day Supply (120 Capsules)",Health,Fishpond AU,AU,*
"August 20, 2022",765326236,https://all.worldfront.co/axis/orders.php?action=edit&oID=765326236,"LONDONTOWN Lakur Peach Please, 10ml",Beauty,Fishpond AU,AU,*
"August 20, 2022",789406084,https://all.worldfront.co/axis/orders.php?action=edit&oID=789406084,Smart for Life Pea Protein Puffs - Organic Vegan Doctor Formulated Plant Protein Powder - Keto Friendly and Vegetarian Plant Base Protein Crisps - Easy to Digest,Health,Fishpond AU,AU,*
"August 20, 2022",791931321,https://all.worldfront.co/axis/orders.php?action=edit&oID=791931321,"Rub-N-Buff 3 Colour Assortment (Silver Leaf, Antique Gold, Gold Leaf)",Arts & Crafts,Fishpond AU,AU,*
"August 19, 2022",55011548,https://all.worldfront.co/axis/orders.php?action=edit&oID=55011548,"Pentel Paint Marker mmp10-x – Paint Markers, Gold (Gold)",Arts & Crafts,Fishpond NZ,NZ,*
"August 19, 2022",90800755,https://all.worldfront.co/axis/orders.php?action=edit&oID=90800755,2x Bull Brand Slim & Ultra Slim Combination Cigarette Machines Adjustable Tobacco Hand Roller,Kitchen,Kogan,World,*
"August 19, 2022",94233645,https://all.worldfront.co/axis/orders.php?action=edit&oID=94233645,"Polarized Wrap Around Sport Sunglasses for Men Women UV400 Sports Sun Glasses, Gloss Black | Smoke, One size fits most",Bags,Amazon AU2,World,*
"August 19, 2022",99340824,https://all.worldfront.co/axis/orders.php?action=edit&oID=99340824,"YOUTHINK Cat Water Fountain, 2L Large Capacity Healthy and Hygienic Automatic Ultra Quiet Pet Water Fountain, Cat Water Dispenser with 1 Filter, Pet Drinking Fountain for Cat and Dog",Pets,Kogan,World,*
"August 19, 2022",715621721,https://all.worldfront.co/axis/orders.php?action=edit&oID=715621721,"Fukuoku 9,000 World's Original Pink Stimulating Fingertip Massager Includes 1 Sensitivity Tip, 1.5kg",Health,Fishpond AU,AU,*
"August 19, 2022",720639199,https://all.worldfront.co/axis/orders.php?action=edit&oID=720639199,(2 Pack) Keto F1 Pills Advanced Ketogenic Support Shark Keto Tank (120 Capsules),Health,Fishpond AU,AU,*
"August 19, 2022",743240536,https://all.worldfront.co/axis/orders.php?action=edit&oID=743240536,Teac TN-3B Belt Drive Turntable (MM Phono EQ Amplifier Built-In Digital USB Output SAEC Tonelight 33 & 45 RPM Speak) - White,Electronics,Fishpond AU,AU,*
"August 19, 2022",760811403,https://all.worldfront.co/axis/orders.php?action=edit&oID=760811403,"Bien-être Colonia Naturelle 500 ml, 1 x 500 ml",Beauty,Fishpond AU,AU,*
"August 19, 2022",764754723,https://all.worldfront.co/axis/orders.php?action=edit&oID=764754723,3x Vaseline Intensive Care Spray & Go Essential Healing Spray Moisturiser 190ml,Beauty,Fishpond AU,AU,*
"August 19, 2022",775652267,https://all.worldfront.co/axis/orders.php?action=edit&oID=775652267,"GHOST Legend Pre-Workout Energy Powder, Sour Patch Kids Redberry - 25 Servings - Caffeine, L-Citrulline, & Beta Alanine Blend for Energy Focus & Pumps - Free of Soy, Sugar & Gluten, Vegan",Health,Fishpond AU,AU,*
"August 18, 2022",50334551,https://all.worldfront.co/axis/orders.php?action=edit&oID=50334551,"Shilajit Pure Himalayan Shilajit Resin - Gold Grade 100% Pure Shilajit with Fulvic Acid & 85+ Trace Minerals Complex for Energy & Immune Support, Pack of 2 (4 Months Supply)",Health,Fishpond NZ,NZ,*
