"November 17, 2022",904297329,https://all.worldfront.co/axis/orders.php?action=edit&oID=904297329,"Reese's Peanut Butter Puffs, Breakfast Cereal, 340ml",Sports & Outdoors,Catch LAX / JFK,World,*
"November 17, 2022",922014658,https://all.worldfront.co/axis/orders.php?action=edit&oID=922014658,Tefal 6-in-1 Multi Moulenette Chopper,Kitchen,Catch LHR,World,*
"November 17, 2022",922300244,https://all.worldfront.co/axis/orders.php?action=edit&oID=922300244,"Weight Tournament Chess Game Set Chess Pieces Only, Chess Board Game Set International Chess Pieces Complete Chessmen Set White And Black (Large-77mm)",Arts & Crafts,Catch LHR,World,*
"November 17, 2022",928129232,https://all.worldfront.co/axis/orders.php?action=edit&oID=928129232,100x Lavazza Coffee Capsules Blue Crema,Kitchen,Kogan,World,*
"November 17, 2022",950236447,https://all.worldfront.co/axis/orders.php?action=edit&oID=950236447,"BESTINNKITS Smart Coffee Set Auto On/Off Gravity-induction Mug Office Desk Use, Candle Wax Cup Warmer Heating Plate (Up To 131F/55C), 410ml",Kitchen,Kogan,World,*
"November 17, 2022",953605699,https://all.worldfront.co/axis/orders.php?action=edit&oID=953605699,100% Authentic Snow Cone syrup 250ml bottle with free integrated pourer. Shave Ice Slush (Pink Bubblegum),Kitchen,Catch LHR,World,*
"November 17, 2022",953605699,https://all.worldfront.co/axis/orders.php?action=edit&oID=953605699,100% Authentic Snow Cone syrup 250ml bottle with free integrated pourer. Shave Ice Slush (Strawberry),Kitchen,Catch LHR,World,*
"November 17, 2022",954488709,https://all.worldfront.co/axis/orders.php?action=edit&oID=954488709,Nespresso Aeroccino 3 WHITE 220 V - 240 V,Kitchen,Fishpond World,World,*
"November 17, 2022",959427796,https://all.worldfront.co/axis/orders.php?action=edit&oID=959427796,Feather Ballpoint Pen ，Black Ink Vintage Feather Quill Refined Plated Rod Quill Ballpoint Pen For School Writing ▏Wedding Gift Signature Pen (White),Stationery,Trade Me,World,*
"November 17, 2022",973329610,https://all.worldfront.co/axis/orders.php?action=edit&oID=973329610,"OOTSR Magnetic Curtain Tiebacks, Curtain Holders Clips Strong Magnetic Window Curtain Rope Holdbacks Buckles Curtain Bracelets for Home Office Bedroom Living Room Decoration Window Treatment (White)",Homeware,Kogan,World,*
"November 17, 2022",976452364,https://all.worldfront.co/axis/orders.php?action=edit&oID=976452364,"WEP 927-IV 60 Watt""Double Digital LED Display"" Soldering Iron Station w/2 Helping Hands & All Accessories - Sleep Function, C/F, Calibration Func, 3 Preset Temps, Brass Sponge w/Flux & Wet Sponge",Lifestyle,Kogan,World,*
"November 17, 2022",985059004,https://all.worldfront.co/axis/orders.php?action=edit&oID=985059004,"Cars Kids' Analogue Watch with Silver-Tone Casing, Red Bezel, Red Strap - Official Cars Lightning McQueen Character on the Dial, Time-Teacher Watch, Safe for Children - Model: CZ1009",Jewellery,Kogan,World,*
"November 16, 2022",723242986,https://all.worldfront.co/axis/orders.php?action=edit&oID=723242986,Tobacco and vanille perfume oil - 10ml roll on bottle-unisex (The perfume people - GP2),Health,Fishpond AU,AU,*
"November 16, 2022",756046035,https://all.worldfront.co/axis/orders.php?action=edit&oID=756046035,Vibox VI-14 Gaming PC with a Free Game - Windows 10 - Monitor Bundle - WiFi - 10th Gen Eight Core Intel i7 Processor - Nvidia RTX 3070 8GB Graphics Card - 16GB RAM - 480GB SSD - 2TB Hard Drive,Electronics,Fishpond AU,AU,*
"November 16, 2022",787420360,https://all.worldfront.co/axis/orders.php?action=edit&oID=787420360,"HM Digital PSC-150 Extended Range EC/TDS Controller, 0-9999 S Measurement Range, 0.1 S/ppm Resolution, +/-2% Readout Accuracy",Homeware,Fishpond AU,AU,*
"November 16, 2022",914434002,https://all.worldfront.co/axis/orders.php?action=edit&oID=914434002,South Beach Skincare All In One Anti-Aging Treatment 2.54 oz,Beauty,Amazon MX2,World,*
"November 16, 2022",914958865,https://all.worldfront.co/axis/orders.php?action=edit&oID=914958865,"Yiesing Adult Bike Helmet,Road/Mountain Bicycle Cycling Helmet for Men and Women with Removable Visor,Adjustable Dail, Flow Vents and Detachable Liner",Sports & Outdoors,Kogan,World,*
"November 16, 2022",958013988,https://all.worldfront.co/axis/orders.php?action=edit&oID=958013988,Ultimate Sun Protector Lotion SPF 50 by Shiseido for Unisex - 141.7gm Sunscreen,Beauty,Amazon AU2,World,*
"November 16, 2022",993313469,https://all.worldfront.co/axis/orders.php?action=edit&oID=993313469,CURKEY 119 in 1 Acrylic Nail Kit Monomer Liquid Set - 36 Colors Glitter Acrylic Powder Set for Beginner with Nail Art Tools - Nail Kit Set Professional Acrylic with Everything for Acrylic Nails,Beauty,Amazon AU2,World,*
"November 15, 2022",736833949,https://all.worldfront.co/axis/orders.php?action=edit&oID=736833949,24x Smint ORIGINAL SUGAR FREE MINTS 40 Pastilles 8g Sugarfree With Xylitol,Health,Fishpond AU,AU,*
"November 15, 2022",738039022,https://all.worldfront.co/axis/orders.php?action=edit&oID=738039022,Standard Process Livaplex 90 C,Health,Fishpond AU,AU,*
"November 15, 2022",902320639,https://all.worldfront.co/axis/orders.php?action=edit&oID=902320639,Weird Science Rainforest Experiment Set Kids Lab Activity Kit 10 Fun Experiments,Toys,Fishpond World,World,*
"November 15, 2022",906904970,https://all.worldfront.co/axis/orders.php?action=edit&oID=906904970,"Sun Sun JVP-110 528-Gph Wave Maker Pumps, 4Piece",Pets,Kogan,World,*
"November 15, 2022",931721311,https://all.worldfront.co/axis/orders.php?action=edit&oID=931721311,"Starbucks Pike Place Roast Medium Roast Ground Coffee, 830ml bag",Kitchen,Catch LAX / JFK,World,*
"November 15, 2022",937082668,https://all.worldfront.co/axis/orders.php?action=edit&oID=937082668,"Antique Quill Pen, Quill Pen Feather Fountain Dip Pen Quill Pen Writing Stationery Business Office Supplies with 5 Nibs Brithday Gift",Stationery,Catch LAX / JFK,World,*
"November 15, 2022",937869952,https://all.worldfront.co/axis/orders.php?action=edit&oID=937869952,Hygger LED Aquarium Lights Clip on Fish Tank Lighting Led Lamp for Fish Tank Blue & White (30 LEDs 13 watt),Pets,Amazon AU2,World,*
"November 15, 2022",938973115,https://all.worldfront.co/axis/orders.php?action=edit&oID=938973115,Bio-groom Magic White (300ml),Pets,Fishpond World,World,*
"November 15, 2022",944954040,https://all.worldfront.co/axis/orders.php?action=edit&oID=944954040,Vatika Henna Dark Brown 60g,Beauty,Amazon AU2,World,*
"November 15, 2022",946620811,https://all.worldfront.co/axis/orders.php?action=edit&oID=946620811,"VTech DM221 Audio Baby Monitor with up to 1,000 ft of Range, Vibrating Sound-Alert, Talk Back Intercom & Night Light Loop, White/Silver",Baby,Amazon AU2,World,*
"November 15, 2022",955225522,https://all.worldfront.co/axis/orders.php?action=edit&oID=955225522,"Electric Air Pump for Inflatables Air Mattress Pump Portable Quick-Fill Air Pump with 3 Nozzles, 110V AC/12V DC, Perfect Inflator/Deflator Pumps for Outdoor Camping,Blow up Pool Raft Air Mattress Beds",Homeware,Kogan,World,*
"November 15, 2022",964181079,https://all.worldfront.co/axis/orders.php?action=edit&oID=964181079,Protection by Shiseido Clear Stick Sun Protection SPF50+ / 0.52 oz. 15g,Beauty,Amazon AU2,World,*
"November 15, 2022",965519739,https://all.worldfront.co/axis/orders.php?action=edit&oID=965519739,"Kitchen Sink Aerator, 360-Degree Swivel Faucet Aerator, Water Saving Faucet with Gasket Faucet Replacement Part for Kitchen,Bathroom - 3 Spray Modes Adjustment",Lifestyle,Kogan,World,*
"November 15, 2022",974979100,https://all.worldfront.co/axis/orders.php?action=edit&oID=974979100,Project MC2 Light Up Diary by Horizon Group USA,Arts & Crafts,Kogan,World,*
"November 15, 2022",979648949,https://all.worldfront.co/axis/orders.php?action=edit&oID=979648949,"Hearth & Harbour Soy Candle Making Kit with Dried Flowers - 50 Pieces - Candle Wax for Candle Making - 0.9kg Natural Soy Wax, Tin, Fragnance Oil, Cotton Wicks, Dried Flowers, and Lot More",Arts & Crafts,Kogan,World,*
"November 15, 2022",982658411,https://all.worldfront.co/axis/orders.php?action=edit&oID=982658411,"Yonanas 988BK Deluxe Vegan Non-Dairy Frozen Fruit Soft Serve Dessert Maker, BPA Free, Includes 75 Recipes, 200 Watts, Black",Kitchen,Amazon AU2,World,*
"November 14, 2022",56920351,https://all.worldfront.co/axis/orders.php?action=edit&oID=56920351,Eden Classics - Rapport Sport - Body Care - 10ml - Male,Beauty,Fishpond NZ,NZ,*
"November 14, 2022",741812840,https://all.worldfront.co/axis/orders.php?action=edit&oID=741812840,10-Seconds Deodorant & Disinfectant (Pack of 2) by 10-Seconds,Beauty,Fishpond AU,AU,*
"November 14, 2022",774519103,https://all.worldfront.co/axis/orders.php?action=edit&oID=774519103,Via Keto Gummies Viaketo Gummies Supports Healthy Weight Loss (60 Gummies )- 1 Bottle,Health,Fishpond AU,AU,*
"November 14, 2022",789732741,https://all.worldfront.co/axis/orders.php?action=edit&oID=789732741,Personalised British Navy Pusser's Rum Bottle Label for New Year Any Occasion,Kitchen,Fishpond AU,AU,*
"November 14, 2022",919220702,https://all.worldfront.co/axis/orders.php?action=edit&oID=919220702,"Violet Mist Hooded Towel Kids Baby Bath Cotton Soft Beach Towel Pool Swim Cover Swimsuit for Boys Girls Toddlers,Dancing Girl",Baby,Kogan,World,*
"November 14, 2022",920203111,https://all.worldfront.co/axis/orders.php?action=edit&oID=920203111,Lavazza Caffe Decaffeinated Italian Ground Coffee (250g),Kitchen,Kogan,World,*
"November 14, 2022",938770392,https://all.worldfront.co/axis/orders.php?action=edit&oID=938770392,Makimoo Bike Basket for Women's Beach Cruiser or Scooter The Original Wicker Bicycle Baskets with Built in Cup Holder for Front Handlebar-Classic Vintage Style Handmade Natural Rattan Wicker,Sports & Outdoors,Fishpond World,World,*
"November 14, 2022",975594366,https://all.worldfront.co/axis/orders.php?action=edit&oID=975594366,Soft Close Toilet Seat | Stable Hinges | Easy to mount | High-quality surface | Energy Stones,Homeware,Kogan,World,*
"November 14, 2022",983342129,https://all.worldfront.co/axis/orders.php?action=edit&oID=983342129,"Red, White and Blue Sprinkles, (Union Jack Mix) Hundreds and Thousands, Edible Cake Decorations (25g)",Kitchen,Catch LHR,World,*
"November 14, 2022",985331873,https://all.worldfront.co/axis/orders.php?action=edit&oID=985331873,"Safer Brand Victor M382 Fly Magnet Trap, 3.8l with Bait",Lifestyle,Kogan,World,*
"November 13, 2022",50994119,https://all.worldfront.co/axis/orders.php?action=edit&oID=50994119,Pool Candy Jelly Beans Pool Tube,Toys,Fishpond NZ,NZ,*
"November 13, 2022",708764256,https://all.worldfront.co/axis/orders.php?action=edit&oID=708764256,"Banzai Aqua Blast Bumper Boat Motorised, Red",Toys,Fishpond AU,AU,*
"November 13, 2022",788021352,https://all.worldfront.co/axis/orders.php?action=edit&oID=788021352,Lego Classic Veterinarian / Nurse Keychain - 3 Inch Tall Figure,Toys,Fishpond AU,AU,*
"November 13, 2022",905656099,https://all.worldfront.co/axis/orders.php?action=edit&oID=905656099,"Corn Remover, Callus Remover, Callus Eliminator, Callus And Corn Remover Liquid, Professional Grade, 10ml",Beauty,Kogan,World,*
"November 13, 2022",917049934,https://all.worldfront.co/axis/orders.php?action=edit&oID=917049934,"CHAREX Realistic Reborn Baby Doll, 60cm Handmade Newborn Weighted Soft Baby Dolls, Vinyl Weighted Doll with Bear Toy, Gifts for Kids Age 3+, Named April",Toys,Kogan,World,*
"November 13, 2022",920286623,https://all.worldfront.co/axis/orders.php?action=edit&oID=920286623,Shiseido Ultimate Sun Protector Cream SPF 50 Unisex Sunscreen 2 oz,Beauty,Amazon MX2,World,*
"November 13, 2022",939306196,https://all.worldfront.co/axis/orders.php?action=edit&oID=939306196,"Nespresso Fortissio Lungo, 10 Capsules",Kitchen,Kogan,World,*
"November 13, 2022",946931997,https://all.worldfront.co/axis/orders.php?action=edit&oID=946931997,Lanman Peru Genuine Agua De Florida Water 270ml - Shamans Cleanse,Health,Kogan,World,*
"November 13, 2022",964787709,https://all.worldfront.co/axis/orders.php?action=edit&oID=964787709,NPKPINK Reborn Baby Dolls Girl 60cm Reborn Doll Lifelike Soft Vinyl Silicone Baby Eyes Open Children Gifts,Toys,Kogan,World,*
"November 13, 2022",982845978,https://all.worldfront.co/axis/orders.php?action=edit&oID=982845978,Home Expressions Heavy Duty Vinyl Magnetic Shower Curtain Liner 180cm x 180cm (Red),Homeware,Kogan,World,*
"November 13, 2022",989866744,https://all.worldfront.co/axis/orders.php?action=edit&oID=989866744,"Brainmart Stark House Viking Drinking Horn mug Set Kit | Tankard For beer mead wine ale | DirtWolf Engraving Drinking Mug with Horn, Shot Glass",Kitchen,Kogan,World,*
"November 13, 2022",990481353,https://all.worldfront.co/axis/orders.php?action=edit&oID=990481353,Large Teak Wooden Rustic Plate Tree Slices Place Mats Cheese Boards Chopping Boards,Kitchen,Kogan,World,*
"November 12, 2022",50715629,https://all.worldfront.co/axis/orders.php?action=edit&oID=50715629,"Paint & Plant Flower Growing Kit - Grow Cosmos, Zinnia, Marigold Flowers - Includes Everything Needed to Paint and Grow - Great Gift for Children STEM",Toys,Fishpond NZ,NZ,*
"November 12, 2022",51001462,https://all.worldfront.co/axis/orders.php?action=edit&oID=51001462,Pautzke Fire Cure 470ml,Sports & Outdoors,Fishpond NZ,NZ,*
"November 12, 2022",51896761,https://all.worldfront.co/axis/orders.php?action=edit&oID=51896761,Riemann P20 Once a Day Sun Protection,Beauty,Fishpond NZ,NZ,*
"November 12, 2022",52289670,https://all.worldfront.co/axis/orders.php?action=edit&oID=52289670,"Shower Curtain Liner, PEVA Antimicrobial PVC Free Shower Curtain, Clear Shower Curtain Liner, Mildew Free, Mildew Resistant Shower Curtain Liner, Mould Resistant Shower Curtain Liner, Eco Friendly Shower Curtain, Vinyl Shower Curtain Liner, No Chemical ..",Homeware,Fishpond NZ,NZ,*
"November 12, 2022",52581833,https://all.worldfront.co/axis/orders.php?action=edit&oID=52581833,Disney Junior Doc Mcstuffin Pet Rescue Doctor's Bag Set with Lil' Nursery Pal Playset (Kitty),Toys,Fishpond NZ,NZ,*
"November 12, 2022",56073357,https://all.worldfront.co/axis/orders.php?action=edit&oID=56073357,Pasamer Upgraded Rechargeable Battery 7.4V 500mAh With USB Cable for WPL / Crawler / Military RC Car,Toys,Fishpond NZ,NZ,*
"November 12, 2022",56639465,https://all.worldfront.co/axis/orders.php?action=edit&oID=56639465,Blonde Boost 60vol Developer,Beauty,Fishpond NZ,NZ,*
"November 12, 2022",57413736,https://all.worldfront.co/axis/orders.php?action=edit&oID=57413736,Jack Black Double Duty Face Moisturiser SPF20 97ml,Health,Fishpond NZ,NZ,*
"November 12, 2022",747232480,https://all.worldfront.co/axis/orders.php?action=edit&oID=747232480,"Tara Toys Ryan's World Road Trip Adventure Kit, Multi",Toys,Fishpond AU,AU,*
"November 12, 2022",762934032,https://all.worldfront.co/axis/orders.php?action=edit&oID=762934032,Verisol Collagen Bioactive Peptides (Natural Collagen Powder) Made in Germany,Health,Fishpond AU,AU,*
"November 12, 2022",793409036,https://all.worldfront.co/axis/orders.php?action=edit&oID=793409036,"[Beautifully Bamboo] Silica Rich Bamboo Tea for Hair, Skin, Nails (30 Filter Paper Bags)",Beauty,Fishpond AU,AU,*
"November 12, 2022",798961064,https://all.worldfront.co/axis/orders.php?action=edit&oID=798961064,Honeywell Wifi 9000 Colour Touchscreen Thermostat,Homeware,Fishpond AU,AU,*
"November 12, 2022",799426720,https://all.worldfront.co/axis/orders.php?action=edit&oID=799426720,Really Tiny Booklight - Pink,Lifestyle,Fishpond AU,AU,*
"November 12, 2022",799426720,https://all.worldfront.co/axis/orders.php?action=edit&oID=799426720,The Really Tiny Book Light - Blue [With Battery],Lifestyle,Fishpond AU,AU,*
"November 12, 2022",799426720,https://all.worldfront.co/axis/orders.php?action=edit&oID=799426720,The Really Tiny Book Light - Gray [With Battery],Lifestyle,Fishpond AU,AU,*
"November 12, 2022",935065757,https://all.worldfront.co/axis/orders.php?action=edit&oID=935065757,RITUALS The Ritual of Mehr Energising Ritual Gift Set Medium,Beauty,Fishpond World,World,*
"November 11, 2022",783092547,https://all.worldfront.co/axis/orders.php?action=edit&oID=783092547,"Large Electric Splatter Ball Blaster with Drum, M416 Gel Ball Blaster with 40000 Water Gel Beads, Double Shooting Modes, for Outdoor Activities, Ages 12+, Blue",Toys,Fishpond AU,AU,*
"November 10, 2022",51151247,https://all.worldfront.co/axis/orders.php?action=edit&oID=51151247,"Blue Lizard Sensitive Mineral Sunscreen Stick with Zinc Oxide, SPF 50+, Water Resistant, UVA/UVB Protection - Easy to Apply, Fragrance Free, Reef Safe.148ml",Beauty,Fishpond NZ,NZ,*
"November 10, 2022",738203000,https://all.worldfront.co/axis/orders.php?action=edit&oID=738203000,"Avon Far Away for Women EDP 50ml , Purse Spray 10ml , Body Lotion & Free Purse ~ Xmas Gift Set 2022",Beauty,Fishpond AU,AU,*
"November 10, 2022",750071005,https://all.worldfront.co/axis/orders.php?action=edit&oID=750071005,Toilet Fishing Game - Potty Fisher Fishing Toy,Toys,Fishpond AU,AU,*
"November 10, 2022",788668109,https://all.worldfront.co/axis/orders.php?action=edit&oID=788668109,Domino Engineering GD1 KEYLESS ENTRY SYSTEM Hardwired Combination Garage Door Keypad,Homeware,Fishpond AU,AU,*
"November 10, 2022",799068838,https://all.worldfront.co/axis/orders.php?action=edit&oID=799068838,"Simpli ACV Ketos Gummies, Simpli Health ACV Ketos Gummies, Simplihealth Simpliacv Heath ACV Keto Gummies, Simple AVC ACT AC ACB Simply Acc Gummies (60 Gummies) (Simpli ACV Gummies 2 Pack)",Health,Fishpond AU,AU,*
"November 10, 2022",904484068,https://all.worldfront.co/axis/orders.php?action=edit&oID=904484068,Mala Beads | Buddhist Mallah bead Rosary Beads | Om mani padme hum,Jewellery,Trade Me,World,*
"November 10, 2022",920546057,https://all.worldfront.co/axis/orders.php?action=edit&oID=920546057,Duncan - Mother-Of-Pearl 30ml ^020,Arts & Crafts,Fishpond World,World,*
"November 10, 2022",929259809,https://all.worldfront.co/axis/orders.php?action=edit&oID=929259809,"Magformers 717001 Amazing Police And Rescue Set Magnetic Construction Toy, Red, Blue, Black, Grey",Toys,Kogan,World,*
"November 10, 2022",969058308,https://all.worldfront.co/axis/orders.php?action=edit&oID=969058308,Duncan - Mother-Of-Pearl 30ml ^020,Arts & Crafts,Fishpond World,World,*
"November 10, 2022",989287825,https://all.worldfront.co/axis/orders.php?action=edit&oID=989287825,"Land of Love Memorial Gifts- Tealight Candle Holder Sympathy Gift, with Flickering Led Candle, Angel Figurine in Memory of a Loved One (Stainless Steel)",Homeware,Kogan,World,*
"November 10, 2022",989696749,https://all.worldfront.co/axis/orders.php?action=edit&oID=989696749,Wood wooden jet black long cord rosary beads necklace 61cm,Jewellery,Trade Me,World,*
"November 10, 2022",994684401,https://all.worldfront.co/axis/orders.php?action=edit&oID=994684401,24 Precut Star Wars The Force Awakens Edible Wafer Paper Cake Toppers,Kitchen,Catch LHR,World,*
"November 9, 2022",50215252,https://all.worldfront.co/axis/orders.php?action=edit&oID=50215252,Ultimate Keto Gummies - Ultimate Keto Pills - Ultimate Keto Gummies Max Potency (60 Gummies - 1 Month Supply),Health,Fishpond NZ,NZ,*
"November 9, 2022",50259535,https://all.worldfront.co/axis/orders.php?action=edit&oID=50259535,"Mrs Awesome Magnetic Curtain Weights, 3 Pairs (6 Pieces) Strong Tablecloth Magnets, Add Heavy Weight, Round, Outside Dia.4cm",Homeware,Fishpond NZ,NZ,*
"November 9, 2022",51883754,https://all.worldfront.co/axis/orders.php?action=edit&oID=51883754,(2 Pack) BioLyfe Keto Gummies - BioLife Keto Gummies - Bio Lyfe Keto ACV Gummies - Bio Life Keto Pills (120 Gummies - 2 Month Supply),Health,Fishpond NZ,NZ,*
"November 9, 2022",51939779,https://all.worldfront.co/axis/orders.php?action=edit&oID=51939779,"Saris Unisex - Adult M2 Smart Exercise Bike - Black, One Size",Sports & Outdoors,Fishpond NZ,NZ,*
"November 9, 2022",55721087,https://all.worldfront.co/axis/orders.php?action=edit&oID=55721087,"BLUE LIZARD Baby Mineral Sunscreen – No Chemical Actives – SPF 50+ UVA/UVB Protection, 150ml Tube",Beauty,Fishpond NZ,NZ,*
"November 9, 2022",58736025,https://all.worldfront.co/axis/orders.php?action=edit&oID=58736025,"Rogue Emergency Survival Ration Gluten-Free, Non-GMO The Survival Tabs 25 Years Shelf Life (180 tablets/Black Bottle/Strawberry)",Health,Fishpond NZ,NZ,*
"November 9, 2022",707047481,https://all.worldfront.co/axis/orders.php?action=edit&oID=707047481,Easy Basketball Court Stencil Kit,Sports & Outdoors,Fishpond AU,AU,*
"November 9, 2022",707998027,https://all.worldfront.co/axis/orders.php?action=edit&oID=707998027,Vitamin B12 Patch - Best Value 16 Patches - up to 4 Month Supply - High Quality 5000 mcg Methylcobalamin & 400 mcg Folic Acid (16 Patches),Health,Fishpond AU,AU,*
"November 9, 2022",710437113,https://all.worldfront.co/axis/orders.php?action=edit&oID=710437113,"DYZI USB Rechargeable Bike Lights Set - 3000 Lumens Waterproof Front Headlight - 100 Lumens Tail Light, Water Resistant, Easy to Fit & Mount, Built in Powerbank for charging devices - 3 Yr Warranty",Sports & Outdoors,Fishpond AU,AU,*
"November 9, 2022",738531481,https://all.worldfront.co/axis/orders.php?action=edit&oID=738531481,Barrys Tricopherous liquid regular - 240ml (2Pack),Beauty,Fishpond AU,AU,*
"November 9, 2022",740936142,https://all.worldfront.co/axis/orders.php?action=edit&oID=740936142,Premium Bumblebee Mask / Bumblebee Voice Talking Face Mask,Toys,Fishpond AU,AU,*
"November 9, 2022",749095300,https://all.worldfront.co/axis/orders.php?action=edit&oID=749095300,Soltan Once Advanced 8hr Protect Lotion SPF50+ 200ml,Beauty,Fishpond AU,AU,*
"November 9, 2022",749926206,https://all.worldfront.co/axis/orders.php?action=edit&oID=749926206,Bumblebee Mask / Bumblebee Talking LED Face Mask,Toys,Fishpond AU,AU,*
"November 9, 2022",904234339,https://all.worldfront.co/axis/orders.php?action=edit&oID=904234339,The Candery Cotton Candy Machine - Bright Colorful Style- Makes Hard Candy Sugar Free Candy Sugar Floss Homemade Sweets for Birthday Parties - Includes 10 Candy Cones & Scooper,Kitchen,Amazon AU2,World,*
"November 9, 2022",908886788,https://all.worldfront.co/axis/orders.php?action=edit&oID=908886788,"Eye Wash Station, Emergency Eyewash Stations Faucet Mounted for Sink Attachment - Eye Flush Unit for First Aid",Lifestyle,Kogan,World,*
"November 9, 2022",911381232,https://all.worldfront.co/axis/orders.php?action=edit&oID=911381232,"Nilco H3 Nilglass Glass And Mirror Cleaner With Spray Nozzle,500ml",Lifestyle,Fishpond World,World,*
"November 9, 2022",917623816,https://all.worldfront.co/axis/orders.php?action=edit&oID=917623816,"Eye Wash Station, Emergency Eyewash Stations Faucet Mounted for Sink Attachment - Eye Flush Unit for First Aid",Lifestyle,Kogan,World,*
"November 9, 2022",926597117,https://all.worldfront.co/axis/orders.php?action=edit&oID=926597117,"Nail Quail - Strong Will Anti-Nail Biting Click Pen, 7ml, Made in USA",Beauty,Amazon MX2,World,*
"November 9, 2022",929462623,https://all.worldfront.co/axis/orders.php?action=edit&oID=929462623,Snazaroo Paleta de pintura facial,Toys,Amazon MX2,World,*
"November 9, 2022",950418490,https://all.worldfront.co/axis/orders.php?action=edit&oID=950418490,"Remington H1016 Compact Ceramic Worldwide Voltage Hair Setter, Hair Rollers, 1-1 ¼ Inch, Purple/Black",Beauty,Kogan,World,*
"November 9, 2022",956202658,https://all.worldfront.co/axis/orders.php?action=edit&oID=956202658,"Ghost Orb of Night 75 ml, Rose Gold",Beauty,Fishpond World,World,*
"November 9, 2022",969189508,https://all.worldfront.co/axis/orders.php?action=edit&oID=969189508,Lavazza 18200091 A Modo Mio MilkEasy Milk Frother - Black,Kitchen,Fishpond World,World,*
"November 9, 2022",969375592,https://all.worldfront.co/axis/orders.php?action=edit&oID=969375592,BLITZWAX Waxing Kit for Women Men Digital Wax Warmer Hard Wax Kit with 50 Wax Accessories 17.5oz Wax Beans for Full Body Brazilian Bikini Armpit Hair Removal,Beauty,Amazon AU2,World,*
"November 8, 2022",56956760,https://all.worldfront.co/axis/orders.php?action=edit&oID=56956760,"XLS Medical XLS-Medical Ultra 5-84 Capsules Last 2 Weeks, 0.09 kg",Health,Fishpond NZ,NZ,*
"November 8, 2022",711111440,https://all.worldfront.co/axis/orders.php?action=edit&oID=711111440,HMS Bellona Starter Boat Kit: Build Your Own Wooden Model Ship,Toys,Fishpond AU,AU,*
"November 8, 2022",764197071,https://all.worldfront.co/axis/orders.php?action=edit&oID=764197071,Waterford Crystal Carriage Clock Large,Homeware,Fishpond AU,AU,*
"November 8, 2022",907684250,https://all.worldfront.co/axis/orders.php?action=edit&oID=907684250,Do Your Gin – Gin making kit | 12 Botanicals and Spices | Perfect present for Men and Women | Make your own homemade Gin,Kitchen,Catch LHR,World,*
"November 8, 2022",909836205,https://all.worldfront.co/axis/orders.php?action=edit&oID=909836205,Hudson Reed Concealed Cistern for Back To Wall Toilet Pan,Homeware,Kogan,World,*
"November 8, 2022",920810620,https://all.worldfront.co/axis/orders.php?action=edit&oID=920810620,"IT Cosmetics Bye Bye Under Eye Corrector de cobertura completa, para ojeras, líneas finas, enrojecimiento y decoloración, impermeable, antienvejecimiento, acabado natural, 20.0 mediano (N), 0.11 onzas líquidas",Beauty,Amazon MX2,World,*
"November 8, 2022",921622559,https://all.worldfront.co/axis/orders.php?action=edit&oID=921622559,"Wilton Christmas Sprinkles Bulk Jar, Jimmies",Arts & Crafts,Catch LAX / JFK,World,*
"November 8, 2022",922984560,https://all.worldfront.co/axis/orders.php?action=edit&oID=922984560,Peter Thomas Roth Pumpkin Enzyme Mask for Women Mask 5 oz,Beauty,Amazon MX2,World,*
"November 8, 2022",946805285,https://all.worldfront.co/axis/orders.php?action=edit&oID=946805285,Best Seller Friendly Magical Creature - Unicorn Projection Torch Light - Children Kids Girls Girl Child Age 5+ Perfect for Stocking Fillers Christmas Xmas Birthday Easter Present Gift Fun Toys & Games or Pocket Money Treat or Reward Idea - One Supplied,Homeware,Catch LHR,World,*
